Image,Id
3b64f52f.jpg,w_c06dd6e w_2663598 w_c1c73c0 w_55c9a3b w_7649712
c939e301.jpg,w_dd76ce2 w_5b1fa1d new_whale w_af6c7e2 w_49a3b14
67b15eb4.jpg,w_a25d46c w_fe95ab8 w_e59294d w_392bee3 w_a254eb0
570e31cf.jpg,w_01a4234 w_a350727 w_cb7b682 w_18bd7b3 w_ca3bb23
2c37e30c.jpg,w_64f3545 new_whale w_01b2250 w_56bbc91 w_32a920b
16083d79.jpg,w_7f81114 w_1d0540c w_985877e w_d3ce445 w_994ff96
14c71293.jpg,w_deb33de w_ace8c54 w_7554f44 w_e428015 w_bb6afc8
5ccdd6b6.jpg,w_b066aa6 w_987a36f w_6f2c662 w_f81c626 w_adc6e1b
5db29063.jpg,w_1cca86d w_7b035cc w_21e178f w_8e97748 w_3061bdd
76a2c2e8.jpg,w_ed10a36 w_88b5d47 w_0b7e949 w_b952580 w_b71eab2
9e140b53.jpg,w_c0d494d w_b942708 w_3b0894d w_987a36f new_whale
f9f153c0.jpg,w_f86488a w_3d0bc7a w_eb47189 w_e80641a w_c0d494d
58110451.jpg,w_b074cdf w_7f1f97b w_1d53d9c w_44a6b62 w_8ba2066
82da40f9.jpg,w_b8dff40 w_a59905f w_fba3bde w_d1eab36 w_2a18a44
2992df3e.jpg,w_eff7e35 w_130508d w_3cada3d w_7649712 w_014a645
fe92cdc4.jpg,w_9b401eb w_1287fbc w_70a31ce w_43b50e5 w_7311fe4
dab256ef.jpg,w_1eafe46 w_895c722 w_987a36f w_96b697f w_67de30b
12d9a68f.jpg,w_38158d6 w_3f907d6 w_33c8db8 w_540fd73 w_676ddb0
e3e6c901.jpg,w_32a920b w_dfbfe10 w_49bbc79 w_bcad8eb w_96c141f
d5f8846e.jpg,new_whale w_a866824 w_559ce61 w_fc433f7 w_f3865d6
6cd62faf.jpg,w_e430ce0 w_b7a832a w_7e8b270 w_f4224b9 w_977d881
755ed840.jpg,w_9caed77 w_2cca6a1 w_33c3ce1 new_whale w_47148ca
c0317da9.jpg,w_f18df18 w_b08520c w_89e159a new_whale w_64f3545
829d71e7.jpg,w_206742f w_3feb2df w_cb05f37 w_ffda8b2 w_831f124
3576558d.jpg,w_932c8cd w_12cdfbd new_whale w_4a78bf2 w_286ec5f
4f35b520.jpg,w_ad512ec w_32602d9 w_8242022 w_330286e w_e09d8cf
2832a5d5.jpg,w_19f0b15 w_c0d494d w_6c803bf w_2386a5a w_7e728d8
45f9b1f7.jpg,w_e826a6f w_bc62c0e w_b074cdf w_b71d930 w_ee24bac
a52b0a4c.jpg,w_28ce17c w_c0d494d w_6c803bf w_87c4190 w_d5ec83f
aedd4703.jpg,w_2f54c3c w_f0f0dbb w_f8cd6b6 w_0d049cf w_00cb685
e0d5c7c1.jpg,w_0013924 w_6d4dedc w_7e48479 w_25fdcfb w_e02fe7b
4e1985a3.jpg,w_814a588 new_whale w_dad23fa w_676ddb0 w_6232813
04413971.jpg,w_e45bc18 w_540fd73 w_67599af w_0da589d w_a4f77bd
66703178.jpg,w_07e92ee w_5297ab3 new_whale w_dc81791 w_7459706
8051910a.jpg,new_whale w_6734e40 w_af76f1e w_ddad87e w_af890ad
ddac18a1.jpg,w_703e39b w_f3bd33a w_19dc50f w_62c548b w_dab33f6
7f744053.jpg,w_f19faeb w_e9f85b7 w_c1b685f w_6a87d0d w_23526cb
9961c79c.jpg,w_cef690d w_dbda0d6 w_6202983 w_7f1f97b w_44a6b62
49746d4e.jpg,new_whale w_d75aff6 w_f3db3f1 w_c80d300 w_588d5d7
bfa9682f.jpg,w_2184d07 w_31fb9f0 w_681dba6 w_adffd9c w_adeee48
0664c407.jpg,new_whale w_e8c35dc w_fb4d1f1 w_3fc3d07 w_9b3ed01
8c24db82.jpg,w_8861715 w_398aa7f w_63db6f9 w_a59905f w_7f40920
6bd1f794.jpg,w_cfe35d4 w_1febbf3 w_8242022 w_62d76c2 w_8f776ed
b85cfbeb.jpg,new_whale w_293b5e4 w_403f92f w_af76f1e w_93bf5f4
7731736a.jpg,w_1a229eb w_1f10750 w_5d96ba4 w_5d84c65 w_31d3999
a4a41051.jpg,w_fd1cb9d w_c27d036 w_865c2ba w_248af0b w_dfec7a3
9ad5fe52.jpg,w_52e7cf6 w_80bae3a w_eb7c39f w_56ccad1 w_a9f41fd
8c2c2057.jpg,w_e0ba9ae new_whale w_1d0540c w_7f81114 w_b31d830
bd5e394c.jpg,w_c2474a2 w_b066aa6 w_3f12226 w_f1a4389 w_1ac4c38
1461727e.jpg,w_ddf14ae w_4791b4c w_c551c9d w_e8a8d85 w_0f73c3c
413ab823.jpg,w_9ea2cc3 w_dbaa2b1 w_389c788 w_17d5eb9 new_whale
9ce20ab4.jpg,new_whale w_eaeb1f0 w_8f1aa27 w_76599c3 w_4c4c001
d52f0e5e.jpg,w_3d66298 w_6d90f45 w_89e159a w_38a3f72 w_9e7021b
295d8fa5.jpg,new_whale w_46a4137 w_0f92544 w_f104523 w_4659761
278ccbbe.jpg,w_fd1cb9d w_43c0762 w_987a36f w_67de30b w_d428980
8015cc46.jpg,w_a19eecd w_993dbe8 w_6cef37c w_76ebad6 w_b68d041
5820b732.jpg,w_e7f8e67 new_whale w_002222a w_53859b2 w_6ba46a1
e4807825.jpg,w_883b284 w_02a768d w_8c957e0 w_4dfe7cb w_7419e4b
cce058f0.jpg,new_whale w_4659acf w_8238d51 w_7ba4b5a w_b638c8f
1a74055b.jpg,w_b5d8846 w_6cb31c8 w_f2b0e93 w_fce6ab2 w_e101deb
8e30d355.jpg,w_7394d75 w_697c72e w_ba2f2c4 w_d78513b w_56743d6
51e63dfa.jpg,w_18eee6e w_2863d51 w_9ceb05d w_17dc953 w_8b56cb1
e13bf974.jpg,w_c9e1cdc new_whale w_d676d44 w_0ee4d6d w_17ee910
68b09059.jpg,w_89154d2 w_fdf60bb w_3ca387d w_b604c18 w_79f5620
2e501bca.jpg,w_2a9727c new_whale w_4dd966d w_dbb315c w_f9fb9d7
a2892438.jpg,w_402784d w_8507226 w_c2474a2 w_8a66718 w_5f0960c
51d3f5cb.jpg,w_f86488a new_whale w_ff7630a w_18eee6e w_d6df554
d9679edf.jpg,w_7f4cd72 w_8c1ec28 new_whale w_8bdc211 w_6545984
22523e77.jpg,new_whale w_8b22583 w_4fdaa2a w_38954da w_dbda0d6
2e405d77.jpg,w_ab039e2 w_5d732da w_081dd6e w_1f606cf w_63d10a1
1b08b573.jpg,w_436a924 w_cd02407 w_d8eae88 w_994ff96 w_c829019
66830611.jpg,w_e62b5d8 w_9d0e84a w_3e5069e w_666b072 w_59349ea
648a302a.jpg,w_dd66cf9 w_bc9dc37 w_a22f338 w_18a854b w_479e3e5
502d14ae.jpg,w_f478955 w_ee17a08 w_4403803 w_6232813 w_993dbe8
382fa599.jpg,new_whale w_3da62f8 w_3dd210a w_af76f1e w_d49402a
af3516d3.jpg,w_d22af00 w_24a2923 w_9b804bd w_e59294d w_79f7d21
5fbac10d.jpg,w_efebfe8 w_6d4dedc w_8fab53d w_95b6cc3 w_2d57dce
434d2438.jpg,w_395d578 w_db0ad01 w_3b016f0 w_dba0cd8 w_823fcbb
3e4d6ddd.jpg,w_ace8c54 w_bb6afc8 w_5bc5fc1 w_7554f44 w_243e33e
9075c129.jpg,w_32a920b w_eb0a6ed w_56bbc91 w_64f3545 w_434ad6a
27301123.jpg,new_whale w_d02787f w_c8728f4 w_20c671c w_93bf5f4
cd905f11.jpg,w_6c899ff new_whale w_3fc8361 w_718ce15 w_3e1ba5b
e839425b.jpg,w_ceffa10 w_e8d0bac new_whale w_c26666e w_01cbcbf
a90c74f4.jpg,w_b9e00eb new_whale w_4e68ddc w_c00534d w_53951e6
58156c84.jpg,w_293b5e4 new_whale w_af6c7e2 w_02d7dc8 w_010a1fa
6c48fad4.jpg,w_95874a5 w_a59905f w_2c717fb w_2fd21ec w_d89b29e
85a5d038.jpg,w_33909b8 w_bd1c23d w_7763134 w_4378542 w_c529cf1
ac08d7f9.jpg,new_whale w_8d83172 w_dfbfe10 w_abe383e w_32a920b
1e6e60ba.jpg,w_b678944 w_1eafe46 w_8867074 w_ff1b64c w_540fd73
35949934.jpg,w_cb7d1b5 w_f660d7d w_8f593d4 w_8c1dab2 w_a2a1378
68b0fdb8.jpg,w_c9dd32e w_eb5b6aa w_a67a1bc w_3e0f25d w_1ec0481
bd6b7f9e.jpg,w_62f804d w_67de30b w_d0cecd5 w_87050a3 w_44f0fa2
735d721d.jpg,w_18df014 w_6c99c53 w_06f0fd3 w_dab75ca w_593485f
1faa051d.jpg,w_a1237e3 w_e449d3a w_5374a4c w_9caed77 w_2881995
6bc3103d.jpg,w_8c1e2e4 w_7879ee1 w_637f363 w_afed305 w_569c2c7
9fa72c86.jpg,w_41fa033 w_ff39e03 w_d4a27fb w_d148982 w_8e25bfa
3a729497.jpg,w_4476e55 w_fe49bc4 w_d7de1ee w_52e7cf6 w_e082823
170b1d2f.jpg,w_dd90e0a w_21e178f w_11adaae new_whale w_243e33e
f1b76310.jpg,w_6ee7470 w_f563449 w_e64c9a6 w_9287bbb w_d6a6360
8303ceae.jpg,w_5b99089 w_2071a4c w_94cd45e w_c0d494d w_bf38f05
be811ebc.jpg,w_8b6fd36 new_whale w_25067c8 w_24212f5 w_f5b8faf
505e81ae.jpg,w_4b04829 w_eec1133 w_db7e2c5 w_16d1b32 w_c0f3e88
0f9856b9.jpg,w_0beef28 w_7f40920 w_4b04829 w_1a70685 w_77e1ae3
4426cf07.jpg,w_ac69cf7 w_33032d1 w_8459e39 w_193b7e3 w_26dd948
e6472acf.jpg,w_6c3d086 w_2687f1b new_whale w_c06dd6e w_034a3fd
4e151847.jpg,new_whale w_f460394 w_d080f35 w_37a7f78 w_009dc00
9735cc02.jpg,w_dbaa2b1 new_whale w_dfbfe10 w_cf24f84 w_32a920b
9e1a7124.jpg,w_d775542 w_ae0ab55 w_2bba8c8 w_cd70e8b w_2f6ad07
13dedeb0.jpg,new_whale w_576db5d w_11adaae w_d0e5d1d w_d1d8f98
78dad3d1.jpg,w_73b705e w_dcb1f2a w_7bf3a5c w_b942708 w_b6886e5
bceae53d.jpg,new_whale w_9d704ab w_9d0e84a w_516bedb w_4a78bf2
81bae29d.jpg,w_2ea9744 w_ba8c7bc new_whale w_9d704ab w_7538a4c
36d877e5.jpg,new_whale w_29cf24b w_3f5e7fc w_4b16688 w_d75aff6
1246c901.jpg,w_cc759cd w_676ddb0 w_19aeb9c w_85cdd9b w_94cd45e
15d30ae9.jpg,w_6398e9d w_0c45f5e w_759b647 w_a7d4668 new_whale
eff1747c.jpg,w_92d390e w_c0d494d w_29670e2 w_e7f03cf w_c84551d
256db2c9.jpg,new_whale w_4ec7c66 w_c26b92a w_1a5beb9 w_599d0df
ca9b78ae.jpg,new_whale w_9ca943b w_69e998f w_5aa4856 w_96b697f
2dff964a.jpg,w_203e9d5 w_2f8aed7 w_1c6d5f0 w_675e8e9 w_5d2734c
3e0c44dd.jpg,w_136337c w_434ad6a w_db7e2c5 w_70daaba w_e826a6f
10cb31da.jpg,w_1969a9d w_f93d780 w_28ce17c w_3d66298 w_6a3210a
7f11727e.jpg,w_a3a65b3 w_520d618 w_e6f5e09 w_83f0b3f w_2216a46
c8fff963.jpg,new_whale w_a18d0dc w_d28208f w_222dcb7 w_cb8edf5
44855cc3.jpg,new_whale w_b47a4a1 w_4fdaa2a w_a59905f w_7538a4c
290c22b1.jpg,w_5f82501 w_f5eb6c6 w_1d38877 w_02a768d w_8327e8d
50630a7a.jpg,w_e826a6f w_9c70a11 w_434ad6a w_86ff8a6 w_25db560
f404c290.jpg,w_c9e1cdc new_whale w_5a2075e w_18eee6e w_67c1b6f
e7632645.jpg,w_1ec0481 w_0acce53 w_bccfcc1 w_c9dd32e w_00fbb4e
eba60f18.jpg,w_c01beb7 w_8e4fa60 w_93b64e9 w_2d25d1f w_86113c4
d20b3ede.jpg,new_whale w_d2be6cc w_0e9f6d9 w_3023ee5 w_c0d494d
350e474b.jpg,w_f115d53 w_3fc3d07 w_5ba417d w_d22af00 w_1f10750
7258db37.jpg,w_1cca86d new_whale w_f660d7d w_6710cf8 w_de5b417
08bd7ff9.jpg,w_69185bb w_9741f42 w_e62b5d8 new_whale w_f2b5de1
f24e9df1.jpg,w_0a97a25 w_ec79861 w_8ba2066 w_4ebeafb w_6c899ff
bbf19403.jpg,w_43be268 w_2dcbf82 w_e3caa40 w_e3c1ec4 w_4e52a49
1a0a5130.jpg,w_8103039 w_eeb5fa7 w_2db01d5 w_48bcad8 w_ccfdb00
69b4fc2d.jpg,w_08f1502 w_0819271 w_ce29d2a w_2e2ba59 w_3674103
2d35d566.jpg,w_eb8429c w_9b67e87 w_1596a47 w_553bb6e w_7c8620c
78910a9e.jpg,w_0c6dbbe w_5317c46 w_143b201 w_74257e8 w_30d8376
bead0b7e.jpg,w_95b6cc3 w_e02fe7b w_67de30b w_b2e1722 w_8c1e2e4
8ec46622.jpg,w_f3e948c w_cfe35d4 w_7caa4fe w_d3f5be3 w_d32adcd
2324703b.jpg,w_243e33e w_f19faeb w_dbda0d6 w_6375873 w_b074cdf
ef6e191b.jpg,w_3c0bbac w_7875b79 w_84a13d3 w_9562910 w_f5eb6c6
8408cc3e.jpg,w_03a2ed7 new_whale w_06f85b2 w_6547e12 w_dff2982
8e1c4a4d.jpg,new_whale w_dbda0d6 w_4b7b80b w_f19faeb w_e9f85b7
dfc50a4b.jpg,new_whale w_b678944 w_1eafe46 w_3e1ba5b w_900fab7
b53fb92b.jpg,w_4c4c001 w_989fbbb w_e10dff3 w_4b1fad6 w_fb270f3
0760ec9a.jpg,w_8db45b7 w_c7b05e7 w_97666c8 w_e74980b w_40cc259
b8de79c1.jpg,w_23dce10 w_7a53e0c w_5d84c65 w_86cc90f w_b55242e
22486971.jpg,new_whale w_735ce7d w_07a425f w_770eb84 w_bf38f05
2c11e418.jpg,w_c5f9e78 w_05ec84e w_1f606cf w_e57b487 w_dd8299b
112ae572.jpg,w_7b035cc w_9ea2cc3 w_18eee6e w_1e3ce01 w_d428980
e0df22f3.jpg,w_e09d8cf w_75378d3 w_e5d6443 w_1af5d59 w_62d76c2
c417a826.jpg,w_cdc21df new_whale w_4e68ddc w_aeca19c w_92585eb
a7c44a15.jpg,w_7e8b270 w_8c1ec28 w_f478955 w_08f1502 w_8fab53d
46b1b846.jpg,w_864be50 w_d8421c1 w_5c0e858 w_3039e7a w_38efc2d
05ec970c.jpg,w_38e4aae w_511c464 new_whale w_62f804d w_2f6a962
b495d543.jpg,w_adb041c w_55d6c4f w_156c0db new_whale w_218b25e
6b127bc3.jpg,w_aae82f8 w_95874a5 w_43be268 w_01a51a6 w_62c3998
297112f1.jpg,w_3add848 w_9875c12 w_c053b99 w_5415fcb w_41da937
4d1f7932.jpg,w_0771d4b w_a31aa30 w_ab6db0f w_5dbe64d w_1b5989e
55ff0725.jpg,w_5817e08 w_0981144 w_e00a916 w_a59075f w_2c83e22
abd3b01e.jpg,w_6503ccd w_b066aa6 w_4e68ddc w_86ff8a6 w_92585eb
05902160.jpg,w_c128384 w_85755f7 w_64783fe w_a1350a7 w_7aaa569
04a5b7d8.jpg,new_whale w_c0cfd5b w_2b930da w_9c449e2 w_9f3e4f4
a7b5dc4f.jpg,w_dbda0d6 w_9a5cd8e w_70daaba new_whale w_25d7f93
b2ed17ce.jpg,w_462a117 new_whale w_3608443 w_313b78a w_0e9f6d9
fee43dc1.jpg,w_8f7b653 w_1eff98a w_1deadd7 w_a2633d4 w_71bfc77
1cc604e7.jpg,w_fd1cb9d w_4ebeafb w_38158d6 w_6d90f45 new_whale
fc29805a.jpg,w_a494171 w_bd1c23d new_whale w_91572bb w_3f907d6
460ee685.jpg,w_6dbb861 w_e59294d w_24a2923 w_94bc64e w_f7e6199
2905a48a.jpg,w_773967d w_52a081c w_b688397 w_7276f4b w_6734e40
cd2aad98.jpg,w_67de30b w_987a36f w_8b56cb1 w_f2e9055 w_6c803bf
bc216286.jpg,w_ff7630a w_b7d5069 w_86b9dfd w_b4732ef w_87050a3
0ad39a95.jpg,w_fd9264d w_cb6a206 w_44edba9 w_9615cf1 w_3297a52
37c12af3.jpg,new_whale w_09e0cbf w_affdf5d w_9b318aa w_8d08f9e
7d20d32a.jpg,w_cd1f1ed w_3b5403b new_whale w_18eee6e w_099c712
64e109bf.jpg,w_e45bc18 w_dace6e9 w_2db01d5 w_b678944 w_44fc081
e2ca6095.jpg,w_1606afc w_2c19c4a w_e700deb w_8861f65 w_4f37147
23c95ea1.jpg,new_whale w_d36f58c w_c8f7bcd w_4dceacc w_53951e6
a6dfb02d.jpg,w_685466f new_whale w_af67683 w_3fffc61 w_06972d2
2062d783.jpg,w_b678944 w_6232813 w_b074cdf w_6047e81 w_814a588
a084a4da.jpg,w_5ba417d w_ba53619 new_whale w_8a31e6c w_ad1d93b
73e9d360.jpg,new_whale w_49a3b14 w_6da177a w_701972b w_c6372b8
69f49edf.jpg,w_eec1133 new_whale w_d59cb45 w_5c0e858 w_1dff010
2e839fc1.jpg,w_bc62c0e w_17e8554 new_whale w_d663f4f w_14c8f15
63160561.jpg,w_901363f w_e6541e4 new_whale w_97f5054 w_b942708
74fa1502.jpg,w_50db782 w_e59294d w_15eae33 w_24a2923 w_a8f9a1e
865eadee.jpg,w_b970272 w_4855bd3 w_e54feba w_660629d w_a59905f
952f69eb.jpg,w_99c07e8 w_081dd6e w_5d732da w_490b224 w_8e23e4c
62597f2a.jpg,w_3f365f3 w_7e8b270 w_78f2e92 w_f1457b5 w_8740039
10cdfe5d.jpg,w_b9e00eb w_1d53d9c w_4fb3c95 new_whale w_d224115
9bed101e.jpg,w_569c2c7 w_e826a6f w_86ff8a6 w_6503ccd w_bc62c0e
1c87af2c.jpg,w_a866824 w_048f7a9 w_2a1d45c w_35c8057 w_4f38350
4a2abe12.jpg,w_59eb8ae w_540fd73 w_8b56cb1 w_d9055d1 w_589b830
16ec2200.jpg,new_whale w_d1ffed1 w_1d53d9c w_bfaa83c w_a71b714
7f8c7c0e.jpg,w_cb7d1b5 w_8f593d4 w_026fdf8 w_a2a1378 w_8c1dab2
f7a19e45.jpg,w_6c3d086 w_bc5beaa w_2a32d3d w_67fecca w_9caed77
6c59a115.jpg,w_e59294d w_06dbe6b new_whale w_79f7d21 w_7aaa569
5a5fe785.jpg,w_f4fc8cc w_3b3b9b2 w_28ce17c w_212b985 w_3166a4d
4590762a.jpg,w_8376b7e w_b31d830 w_5f68f56 w_d8eae88 w_a0ae961
a21cb55b.jpg,new_whale w_e0ba9ae w_1911cbb w_dc7c5a0 w_5f47726
f6ed0925.jpg,w_4b7b80b w_b939998 w_fe6617a w_5e57e8b w_efebfe8
69d796f5.jpg,w_01c2cb0 w_8242022 w_cfe35d4 w_62d76c2 w_38a3f72
4d9cf4ec.jpg,w_4be373e w_5d96ba4 new_whale w_e41fd4f w_a25caa9
2a983910.jpg,w_da63cba w_3d66298 w_89e159a w_4790f64 w_3fa2cb1
aa459de8.jpg,w_db2baec w_8cd3036 w_0265cb6 w_9d3ba38 w_97982cf
75f18083.jpg,w_7763134 new_whale w_02d5fad w_7133c9d w_0819271
1c177a95.jpg,w_471cca4 w_50db782 w_b2b74f0 new_whale w_8ebb024
d5b028e1.jpg,w_8b2cc42 w_ddf3c52 w_6c8601e w_19c005a w_d59cb45
c231cffc.jpg,w_3b016f0 w_1606afc w_accd48e w_e700deb w_b604c18
6a1bebba.jpg,w_3d66298 w_6e8486d w_89e159a w_f18df18 w_c8d20aa
9e74cca8.jpg,w_8c1e2e4 w_18eee6e w_9ea2cc3 w_0beef28 w_099c712
c6c5e0a8.jpg,w_aa16da4 w_dbda0d6 w_d9adb4f w_b4a5677 w_8d4654f
63071de1.jpg,w_b678944 w_ed69e9c w_4b18498 w_9c3db0a w_46a4473
a25ae909.jpg,w_2c1dafa w_c39fceb w_1161030 w_f68d0af w_1b6d34d
3c3d4d45.jpg,new_whale w_488cdd8 w_d984eb7 w_964c1b3 w_2669d75
07441b1a.jpg,w_6b3402d w_462a117 w_0e9f6d9 w_6c803bf w_7a9f3f6
a7aface1.jpg,new_whale w_7f999ff w_2b28681 w_49ae15d w_cd1f1ed
c141799d.jpg,w_9b67e87 w_8db45b7 w_2bba8c8 w_3db53dc w_eeb5fa7
8b062d45.jpg,w_7554f44 w_b9e00eb w_434ad6a w_87050a3 w_b074cdf
1cbfe28b.jpg,w_b8236d6 new_whale w_d6856ab w_28fa29e w_4b04829
206738e2.jpg,new_whale w_87c4190 w_5dbe64d w_050bdac w_945aefe
03df3506.jpg,w_61b87f9 w_1ac4c38 w_8b56cb1 w_a5deba3 w_6438b7d
6e1b5a76.jpg,w_076daec w_9874f0d w_b5d8846 w_5bdcd94 w_544d0c1
f33f041d.jpg,w_95874a5 w_dcb1f2a w_cb7b682 w_1b332ba w_703e39b
f1f229a2.jpg,w_33e0287 w_a0ae961 new_whale w_e0ba9ae w_7f81114
70705510.jpg,new_whale w_fed0031 w_1000f90 w_1948625 w_40e3ee7
6db1beb0.jpg,w_cd38536 w_f79563e w_4041a7b w_11b993a w_6611a71
1eec8f00.jpg,w_f7d5919 w_e09d8cf w_e5d6443 w_62d76c2 w_32602d9
18aaa78c.jpg,w_d9fdd15 w_7b035cc w_505a141 new_whale w_d0b237f
67c759e9.jpg,w_e54feba new_whale w_a481883 w_33fc58d w_3061bdd
c3c8b471.jpg,w_a533837 w_67fecca w_9c3db0a w_70a31ce w_d36f58c
bff4ca79.jpg,w_f19faeb new_whale w_c1b685f w_48a5b86 w_72e70e5
6c03de3f.jpg,w_abe383e new_whale w_17ee910 w_c8d20aa w_8c1e2e4
78477c59.jpg,w_2f283f3 w_4cff2f8 w_98f0e93 w_6092d5c w_434ad6a
3f849bc0.jpg,w_dbda0d6 new_whale w_38efce7 w_861cc1c w_b96d4e0
cb7c2696.jpg,w_616ca36 w_4ec48a9 w_f803b29 w_29fc08a w_2482b4a
d44dc8cb.jpg,w_bf69a19 w_9122179 w_ab6db0f w_89e159a w_b38374a
9df35c61.jpg,w_bc9dc37 w_398aa7f w_a59905f w_2a18a44 w_3d4900b
0bbf5390.jpg,w_a59905f new_whale w_ab6db0f w_8861715 w_398aa7f
b992485d.jpg,new_whale w_e02fe7b w_286ec5f w_58c3bf9 w_64f3545
0b1666a7.jpg,w_e15442c w_8a997b8 w_06f0fd3 w_0ea659e w_eb9ab29
74925121.jpg,w_f208155 w_b648329 w_5f68f56 w_0771d4b w_6d05f7f
696fe9a0.jpg,new_whale w_cbda4ca w_ed69e9c w_9615cf1 w_d96a0cd
9fc33eb7.jpg,w_9ceb05d w_3e1ba5b w_49bbc79 w_32a920b w_43966a3
dec917ca.jpg,w_7538a4c w_f71bac2 w_c8bf168 w_b8dff40 new_whale
b6e65a85.jpg,new_whale w_b9df6da w_f460394 w_4e0eaa1 w_22fa4ad
a63aa92c.jpg,w_895c722 w_656afeb w_21dfc18 new_whale w_2fd21ec
2df079aa.jpg,w_af890ad w_c01e25d w_a7f3698 w_52a081c w_981a39b
900d93cc.jpg,new_whale w_38e4aae w_4f6fabd w_da2efe0 w_b08520c
39c8a23b.jpg,w_a2e2f8e w_414c24a w_515d21d w_e94d02c w_9d9913a
4a7f1898.jpg,new_whale w_296749b w_96fd936 w_6c803bf w_62f804d
8efabfdd.jpg,w_c48ad3e w_d428980 w_1310342 w_8b56cb1 w_a4f77bd
333a60fc.jpg,new_whale w_11adaae w_40e3ee7 w_61cf42e w_78999a6
9a00a892.jpg,w_b4ad62f w_3172910 w_2d2d7fe new_whale w_f5b8faf
56683c94.jpg,new_whale w_da2efe0 w_c0d494d w_b942708 w_1ecfe96
15a40594.jpg,w_2725793 w_d22af00 new_whale w_9948a99 w_0e7cb1c
9275cc18.jpg,w_987a36f new_whale w_11adaae w_6f40f26 w_e61dd6d
f73e5189.jpg,w_1a70685 w_2bba8c8 w_7b5a630 w_9438980 w_4ec7c66
ed39ea00.jpg,w_7923fdc w_c663985 w_4fe4078 w_f0af1f8 w_231a0c8
fa1df03e.jpg,w_78a6f56 w_9434f0c w_83034c7 w_b55242e w_cddb3f4
29f0c754.jpg,w_a1237e3 new_whale w_c71bf0e w_9caed77 w_0b3b659
93f3c60b.jpg,w_3b3b9b2 w_c0d494d w_34c4927 w_813c5be w_2a939eb
34fe1dd8.jpg,w_7554f44 w_87050a3 w_367b996 w_b033b36 w_f478955
50d2f8e4.jpg,w_b8dff40 w_a22f338 w_18eee6e w_e3c119c w_df092eb
4723946c.jpg,w_42c631a w_e6f5e09 w_5acfa65 w_b8ea509 w_e0c6ead
ed278f82.jpg,w_a1350a7 w_36a853c w_29670e2 w_ac851eb w_79f7d21
b388269a.jpg,w_c06dd6e w_7914111 w_b5d8846 w_fd6e8d2 w_55c9a3b
6bd23561.jpg,w_7311fe4 w_a155149 w_367b996 w_d1b13bb w_d36f58c
e822fa31.jpg,w_f79b3f9 w_290f82b w_afe57c6 w_90201e3 w_64433af
53afa198.jpg,w_35453e0 w_b08520c w_20e863f w_38e4aae w_4659acf
22388163.jpg,new_whale w_2071a4c w_613723e w_95dd5d2 w_ed5cdab
13a35519.jpg,w_6a7478d w_39f2064 w_a8990f1 w_dc97dc3 w_7600863
bd0a82b2.jpg,w_872a86c w_64783fe w_5810973 w_3f91e04 w_79f7d21
66630f76.jpg,w_1ac4c38 w_3fa2cb1 w_ff2c4a4 w_d9adb4f w_e39371c
91b30954.jpg,w_398aa7f w_1eafe46 w_bf8c3d2 w_1ac4c38 w_895c722
16149c0b.jpg,w_735675e w_681dba6 w_5d0a13f w_3136deb w_25a38b8
f1c0e1e8.jpg,w_5ba417d w_851a7f4 w_980bb1a w_c622a3f w_8a31e6c
ec875b94.jpg,w_38e4aae new_whale w_62f804d w_b08520c w_f21f2ec
e2f875b3.jpg,w_dd76ce2 w_a25caa9 w_ef52dd3 w_cacfe12 w_962164f
5cd4d5eb.jpg,new_whale w_1a70685 w_38e4aae w_89e159a w_96c141f
f06dd353.jpg,w_3411b9f w_0beef28 w_17136dc new_whale w_abe383e
db276e4c.jpg,w_48f649e w_206e903 w_d0cecd5 w_1917275 w_43be268
813fc646.jpg,w_b066aa6 w_ad87135 w_1287fbc w_977d881 w_7e8b270
eeffa31a.jpg,w_28fa29e w_4dd966d w_82e0d98 w_27633c3 w_69e998f
8b943baa.jpg,w_1ec0481 w_55647bd w_edcb241 w_ca8bfb4 w_49a7077
23cbbad3.jpg,w_6c803bf w_b96d4e0 w_413057d w_861cc1c w_3745f59
113f4e44.jpg,w_679f2eb w_49c9417 w_373593e w_74de378 w_df309be
3b4c895f.jpg,w_1a229eb w_56743d6 w_24ad46c w_8309df3 w_ed8a846
40c1e233.jpg,w_3d8c865 w_4e68ddc w_b9e00eb w_26dd948 w_3172910
d34f8cfe.jpg,w_dd52cfc w_0c8a724 w_701972b w_f369a80 w_f763429
c9187cb2.jpg,w_b440303 w_29670e2 w_2c1634b w_02cf46c w_ddf14ae
5c90f51c.jpg,w_e214820 w_95874a5 w_06a6351 w_367b996 w_62c548b
172a051f.jpg,w_797e546 w_f0af1f8 w_f014da3 w_2111212 new_whale
073da2c4.jpg,w_5bb7ae9 w_449e238 w_a1b985a new_whale w_403f92f
90d1a7b5.jpg,w_98baff9 w_861cc1c w_3674103 new_whale w_721d2e9
112f3797.jpg,new_whale w_1a4f16e w_b1a4f29 w_94da90b w_e94a3b2
2c648f93.jpg,w_4fd48e7 w_91572bb w_bd1c23d w_43b50e5 w_e73d83c
a7db40a5.jpg,new_whale w_f208155 w_69f4311 w_e62b5d8 w_7ed0d17
ea6b7afc.jpg,w_8f6b207 w_735ce7d w_837646b w_38bcd3e w_4d98ef7
3892b4c5.jpg,new_whale w_d36f58c w_53951e6 w_4e68ddc w_8c1ec28
249dfa15.jpg,w_0a97a25 w_b6c4efa w_e6d89c0 w_0324b97 w_d3ce445
487846a8.jpg,w_e603cc5 w_d88328d w_fc7cc24 w_02d5fad w_516bedb
c3f5d4df.jpg,w_a2f02c0 w_aa16da4 w_5be8e63 w_560661c new_whale
2fef1d4b.jpg,w_c2474a2 w_b46bd60 w_5810973 w_d58a303 w_d2b4956
9aaecd4c.jpg,w_9023f3b w_c39fceb w_cfe35d4 w_8397970 w_a67a1bc
fd508ca8.jpg,w_54c00ad w_211aa88 w_7185713 w_c01beb7 w_cf8b725
a4998c6f.jpg,w_505a141 w_9ea2cc3 w_516bedb w_28ce17c w_21e178f
afff48fc.jpg,w_e4c8d6d w_83accca w_6e20206 w_bde9c34 w_a5f7fce
51a64f40.jpg,w_80245ee w_ae1db8a w_fae2cb6 w_7f999ff w_be32bec
65199df7.jpg,w_f0fc693 new_whale w_a2a1378 w_02a768d w_7dee51b
5311c692.jpg,new_whale w_17ee910 w_ba4cd1a w_b4732ef w_b7d5069
d444086f.jpg,new_whale w_4e52a49 w_38e4aae w_89e159a w_b08520c
ae2b10ab.jpg,w_ab4bd59 w_0acce53 w_ec67c71 w_1ec0481 w_096bc48
d0f3d444.jpg,w_9b67e87 w_e3c1ec4 w_f8cf8ca w_ddf3c52 w_f51b4bc
9e6f4dd8.jpg,new_whale w_3f90907 w_5797d05 w_e8778ce w_232e5bd
0d587fa3.jpg,w_8bdc211 w_1a229eb w_b0e6fbe w_d6a6360 w_690fc6b
397ea63e.jpg,new_whale w_4a069df w_07e92ee w_03ed3de w_17e592c
f3e89d1a.jpg,w_ca8bfb4 w_8327e8d w_18a1bf2 w_2e872af w_fe054f3
5383d09c.jpg,w_bd43538 w_1743d93 w_b721e96 w_96b697f w_b638c8f
f4311022.jpg,w_8e92130 w_4f28a45 w_681dba6 w_bde9c34 w_1969a9d
f13930b9.jpg,w_97f5054 w_4b7b80b w_f478955 new_whale w_f099dc8
499b0417.jpg,new_whale w_2e872af w_c11932e w_18a1bf2 w_073f071
ebb15d22.jpg,new_whale w_3411b9f w_b95307d w_df092eb w_7f81114
6334ed04.jpg,new_whale w_91572bb w_9caed77 w_92d390e w_bc5beaa
8608562b.jpg,w_3c2d938 w_5d732da w_ef52dd3 w_e4c8d6d w_b83b069
a07c5ba7.jpg,w_ddbf533 w_7de72c5 w_303518a w_964c1b3 w_c11932e
dba9aa05.jpg,new_whale w_33973bf w_0ee4d6d w_2957331 w_4659acf
a3bf7e2c.jpg,new_whale w_d95069e w_1e75406 w_e59294d w_8abcb09
08e7f5ae.jpg,w_ee9c4d7 new_whale w_715d152 w_d88328d w_4b87cba
83a0d1dc.jpg,w_0e4f53c w_1dd8e68 w_3b483d3 w_80e649e w_a71aa99
b880827e.jpg,w_d224115 w_fe054f3 w_488cdd8 w_5cb5fc3 w_83714b7
8cb76e48.jpg,w_9948a99 w_015c991 w_2e872af w_eb39613 w_18a1bf2
0f1b6af2.jpg,w_efaada7 w_4ebeafb w_1274a11 w_2811cea w_d4fa6f3
2eeba64d.jpg,w_3ee8570 w_ebf9290 w_a4b6a86 w_e39371c w_8a0192f
3edfb3ac.jpg,w_e73d83c w_c30959a w_ee17a08 w_19dc50f w_703e39b
2be8907a.jpg,w_127f4c6 new_whale w_38e4aae w_3e1ba5b w_0156f27
cb84e66b.jpg,w_1a70685 new_whale w_208de0e w_9ec358c w_da2efe0
d3225aa0.jpg,w_9948a99 w_0819271 w_09f9fd3 w_09c1e0b w_70a31ce
c0d44c6a.jpg,new_whale w_dfd7ee8 w_b4a5677 w_b8dff40 w_a59905f
c6422011.jpg,w_d36f58c w_b678944 w_7763134 w_f478955 w_6d17527
3b2c6b6b.jpg,w_a31635b w_cddb3f4 w_68b47a1 w_676ddb0 w_37223f9
17686f57.jpg,w_d775542 w_ae0ab55 w_0f96780 w_651cbb7 w_2bba8c8
4313c71b.jpg,w_fa32440 w_759b647 w_a837660 w_5d86f98 w_4e68ddc
7313b25a.jpg,w_d6df554 w_9c3db0a w_a533837 w_7e8b270 w_c74ab24
d22be6cf.jpg,w_eb0a6ed w_2855124 w_8e92130 w_1287fbc w_cbedcb0
4f7efe0f.jpg,new_whale w_31fb9f0 w_92b35ca w_09d7946 w_37374fa
196bfcb1.jpg,w_fcfcf68 w_37223f9 w_156c0db w_339c8ae w_ef67a6c
c2a088c9.jpg,w_61d516e w_a837660 w_d224115 w_1287fbc w_8b6fd36
6367f41b.jpg,w_f18df18 w_32a920b w_9ceb05d w_18a854b w_38e4aae
35809609.jpg,w_63d1ea6 w_ba53619 w_3572e7e w_1a229eb w_851a7f4
346eeccb.jpg,w_e02fe7b w_7ba4b5a w_4855bd3 new_whale w_a59905f
97acfdb5.jpg,w_97f5054 w_777f59a w_d6255a4 w_7b69289 w_38158d6
e9975c0c.jpg,w_44cccf6 w_fc7cc24 w_dcb1f2a new_whale w_987a36f
a59e740b.jpg,w_c0d494d new_whale w_b942708 w_9ec358c w_dfec7a3
16d28d71.jpg,w_ca0ec7c w_6ee7470 w_edcb241 w_51652ee w_9287bbb
134d3460.jpg,new_whale w_cfe35d4 w_b440303 w_5f0a14c w_da0f481
70802804.jpg,w_b41e229 w_7c7a78c w_06a6351 w_d6e437d w_dcb1f2a
41d3f4c3.jpg,w_8397970 w_cfe35d4 w_6d90f45 w_a964291 w_1e31d24
2d5d5861.jpg,w_de20ab0 w_3ce788a w_32475a1 w_5054c6a w_2085f2e
c1117fca.jpg,w_a494171 new_whale w_e6d0696 w_f83b1f9 w_09e0cbf
9315a9d7.jpg,w_26dd948 w_6d4dedc w_f0b4252 w_f334363 w_3ae3603
5b47354b.jpg,w_5810973 w_5af83da w_6a6b3b3 w_80b1c48 w_83f0b3f
dde6372d.jpg,w_c3ff6f2 w_339c8ae w_1632307 w_cf7eebd w_4be373e
9b70f587.jpg,w_471cca4 new_whale w_50db782 w_67f61c7 w_3565288
12eeb4fe.jpg,w_99ad599 w_31a93e7 w_05567a9 w_1d53d9c w_f8cd6b6
3facb60e.jpg,w_8c1ec28 w_f02bf23 w_243e33e w_c6be61e w_7311fe4
3f840442.jpg,w_3172910 w_09c1e0b new_whale w_e45bc18 w_d224115
8e8abf9c.jpg,w_9438980 w_7f40920 w_d0b237f w_e3c119c w_0beef28
24610cd2.jpg,w_3af4e73 new_whale w_53ed912 w_6710cf8 w_a16b600
81804ac2.jpg,w_993d66c w_3f365f3 w_a31aa30 w_b067417 w_ef7cdd5
df9c5b04.jpg,w_1a70685 w_fd1cb9d w_3b3b9b2 w_38e4aae w_20e863f
ed41305c.jpg,w_2cde7c0 w_6e742e5 w_8c1e2e4 new_whale w_d6e437d
b62db6d1.jpg,w_09dd18c w_49c640f w_3572e7e w_1eafe46 w_a8335f2
92513621.jpg,w_cf0c062 w_cece268 w_528e753 w_3050553 w_fe36b07
32fef3f2.jpg,w_9c3db0a w_4643de5 w_6e7b28b w_3fcb80e w_35f0fd9
8e09e3dc.jpg,w_63d1ea6 w_3fc3d07 w_e430ce0 w_851a7f4 w_7b770ec
30cb2858.jpg,w_1deadd7 new_whale w_f53deac w_e6d3a57 w_71bfc77
4dc4cd1d.jpg,w_df21074 w_397e3db w_eff7e35 w_0ac9006 w_8329cea
f5e4d2d2.jpg,w_5cc2285 w_1274a11 new_whale w_17d5eb9 w_72d5b6c
07929e47.jpg,w_826eb44 w_f0fc693 w_3b016f0 w_1743d93 w_44237e0
20e3ad2f.jpg,w_73c9ba2 w_0b0b7cc w_305ed07 w_c20f21c w_73d5489
ffed4ca3.jpg,w_44cccf6 w_fc7cc24 w_dcb1f2a new_whale w_987a36f
2d37d22e.jpg,new_whale w_451f507 w_8d83172 w_d0b237f w_9ceb05d
21b183a5.jpg,w_25871da w_fb2c3fb w_5f54bf3 w_74adf0b w_fcfcf68
b1fc7879.jpg,new_whale w_b9c9129 w_4dfe7cb w_eea20c4 w_09e0cbf
2e3caf68.jpg,w_3b483d3 w_04c1951 w_f546b0a w_406331a w_76390b4
e0c6ac16.jpg,w_d22af00 w_136337c w_9948a99 w_efd3f81 w_0e4f53c
287d564b.jpg,w_a2a1378 w_92b35ca w_7f45825 w_94e1ed4 w_62c3998
0cbd80c1.jpg,w_4b950da w_2cadad2 w_bf14813 w_c4c8491 w_b089088
829dceee.jpg,w_74de378 w_c1540a3 w_29d2cec w_02facde w_dd66cf9
50af9ba9.jpg,w_4d98ef7 w_7419e4b w_cc759cd w_64f3545 w_e0efc4f
b7ed8a92.jpg,w_5f50b5e w_25d7f93 w_64f3545 w_883b284 w_d234e6b
03f28af0.jpg,new_whale w_40323ac w_4b7b80b w_afe953f w_8a66718
e5437846.jpg,w_7c7a78c w_85f9040 w_63db6f9 w_aa446ad w_fd07344
5eea2ecb.jpg,w_3d0bc7a w_b942708 w_bcad8eb w_69185bb w_49bbc79
a11f1a67.jpg,new_whale w_38e4aae w_718ce15 w_4c9d3df w_462a117
0941fdfc.jpg,w_17ee910 w_cb05f37 w_ffda8b2 w_206742f w_97f5054
4fb92789.jpg,w_de5b417 w_a358522 w_74de378 w_db474c7 w_79071e8
2998e03b.jpg,w_8c1e2e4 w_28ce17c w_dbaa2b1 w_d6df554 w_ec354a5
c15bd982.jpg,new_whale w_3af4e73 w_bbd9409 w_7c7a78c w_d398969
9366a2a8.jpg,w_ecb9a79 new_whale w_38bcd3e w_57c14db w_ba17206
d0c0a031.jpg,w_2f283f3 w_2901dbf w_7637760 w_235b156 w_9023f3b
560bb2e7.jpg,w_d8f848c w_70a31ce w_3fc7f1e w_c8d20aa w_3f907d6
03e22730.jpg,w_8cd3036 w_9d3ba38 w_db2baec w_0c6dbbe w_38e4aae
