Image,Id
02e4cbe1.jpg,new_whale w_53064a6 w_9cb529f w_1dff010 w_883557a
bb2e6ba9.jpg,w_693c9ee w_0c42dba w_98baff9 w_aa16da4 w_861cc1c
b2c0c752.jpg,w_f60c7e8 w_6c99c53 w_dab75ca w_528e753 w_cf0c062
2c4f63b5.jpg,w_ffa78a5 w_4e68ddc w_7e8b270 w_aeca19c w_8507226
5db95dc3.jpg,w_1a70685 w_54c00ad w_4659acf w_96b697f w_98baff9
d9f261d8.jpg,w_f63d8b0 w_46b211d w_f2b8caf w_96d9eaf w_db93738
9a91769a.jpg,w_73d5489 w_5dc1c2d w_0e4f53c w_5010531 w_845f7ca
2b9330e8.jpg,new_whale w_6a87d0d w_883557a w_cce0444 w_243e33e
0809716b.jpg,w_52b06b1 w_a14ccaa w_eac205a w_ddf14ae new_whale
22106f09.jpg,w_bc9dc37 w_0dee306 new_whale w_1cca86d w_7ae398c
36920e34.jpg,w_7377b2b w_4c4c001 w_52a081c new_whale w_f6411ea
58ead831.jpg,w_813c5be w_32a920b w_3f365f3 w_18a854b w_bd6e2dd
6074df2a.jpg,w_92d55a6 w_8cd3036 w_cd02407 w_e39dcea w_9d3ba38
a33bca03.jpg,new_whale w_31fb9f0 w_d76d3bb w_a2b3d53 w_a21cc97
c3ec52ae.jpg,w_232e5bd w_6b03eb4 w_daf162a w_001ebbc w_6132293
3ddc3d7e.jpg,w_b4eeae6 w_e1f55ad w_e53334f w_a9f41fd w_eff7e35
63486b1a.jpg,w_4b7b80b w_b0e05b1 w_95b6cc3 w_daa4876 w_7ba4b5a
dbe3443f.jpg,w_449e238 w_e62680c new_whale w_dd0c2e0 w_30cf2ca
1a5772ab.jpg,w_f0f0dbb new_whale w_3aa2073 w_0c6d50d w_303518a
7461e8aa.jpg,w_1a229eb w_c2c4f43 w_af98182 w_3674103 w_f7fed13
0891a824.jpg,w_62f804d w_67de30b w_d6e437d w_a3cd405 w_6556c5c
e17288fb.jpg,w_5059889 w_a2e2f8e w_76c2a95 w_705e0fb w_831f124
377b3eb0.jpg,w_0337aa5 w_cc759cd w_1a70685 w_10ace22 w_73e1d5b
09c424bc.jpg,w_a254eb0 w_53e9072 w_c207f9d w_88e679c w_414c24a
d40ac623.jpg,w_f6d32e2 w_2ce5ce2 w_ceffa10 w_3dd1a87 w_721d2e9
f7504eb6.jpg,w_ef7cdd5 new_whale w_2641733 w_f4224b9 w_3f365f3
d448c47d.jpg,new_whale w_2a9727c w_389c788 w_4dd966d w_d6df554
a70d6446.jpg,w_5dddfbe w_d67071c w_cad1a8d w_38a3f72 w_e94d02c
00367faf.jpg,w_813c5be w_32a920b w_17ee910 w_dfbfe10 w_62f804d
06f099aa.jpg,w_dc7c5a0 w_6c803bf w_3621c49 w_1e3ce01 w_7c18f3c
351fbe02.jpg,w_e082823 w_6f580eb w_38954da w_d1d8f98 w_367b996
c149947b.jpg,w_932c8cd new_whale w_38e4aae w_fd1cb9d w_b729b1f
057fe50e.jpg,w_b066aa6 w_4fb3c95 w_b9e00eb w_08f1502 w_44a6b62
61b73156.jpg,w_87e00c8 w_f208155 w_4114553 w_29fc831 w_28fa29e
d5319e7b.jpg,w_9b401eb w_0819271 w_91572bb w_e603cc5 w_43b50e5
01cd27f0.jpg,new_whale w_dace6e9 w_83a922d w_adeee48 w_c6bd2bb
f127e627.jpg,w_e5d6443 w_ec27074 w_1e31d24 w_01c2cb0 w_2cb8996
ab9146be.jpg,w_cece268 w_38e088a w_cf0c062 w_fe36b07 w_9b401eb
f74b0277.jpg,w_cae7677 w_eb0a6ed w_25d7f93 w_7852bd1 w_ddbf533
cded188d.jpg,w_5aa4856 w_540bf45 w_c0c1a30 w_16e3c6b w_0b3c02c
2015b485.jpg,w_fea7fe6 w_8c1e2e4 w_8534390 w_db2baec w_abe383e
2535d991.jpg,w_c5f9e78 w_983829b w_64a51a4 w_dd8299b w_096bc48
c47f31ab.jpg,w_703e39b w_19dc50f w_aed6a9a w_f4e0748 w_62c548b
36aedbdd.jpg,new_whale w_1d53d9c w_e41f2fa w_49a3b14 w_bbc4e7c
97e8595f.jpg,w_9122179 w_1cca86d w_d428980 w_6710cf8 w_f660d7d
87371d91.jpg,w_ccbc782 w_b71eab2 w_c87b956 w_e08089e w_cdda58e
6b7d19d5.jpg,new_whale w_46e45e6 w_af890ad w_15f29b7 w_e10dff3
ade0d70c.jpg,w_296749b w_b6c4efa new_whale w_3061bdd w_0beef28
3b01fac5.jpg,w_b7a3e0a w_ccbc782 w_6d3ca42 w_19c005a w_0b7e949
82b8ed04.jpg,w_53549df new_whale w_a3a65b3 w_4c25641 w_b1d6681
8942a06a.jpg,w_53064a6 w_a5ab9d1 new_whale w_1029f4e w_18eee6e
3022fa66.jpg,w_4d528e4 w_2f6ad07 w_dfec7a3 w_cf69291 w_599d0df
016003f6.jpg,w_a59905f w_625a6a9 w_b8dff40 new_whale w_3f550fa
c687d1da.jpg,w_e4f1fcc w_24bdae3 w_f8d2cd9 w_983829b w_e8ba2d8
cdee60cf.jpg,new_whale w_d3c8520 w_ce29d2a w_a8ec52f w_578a509
eb63b9b5.jpg,w_12c3d3d w_ca0ec7c w_5d732da w_5bdcd94 w_9287bbb
a211033e.jpg,w_0d48a7d w_c30959a w_a3dfe32 w_2d2d7fe w_dbda0d6
8ee21a2d.jpg,w_9577f88 w_8fab53d w_3ae3603 new_whale w_ffa78a5
a078e729.jpg,w_6c803bf w_711aaa1 w_4fa1bd5 w_9ea2cc3 w_e3c119c
c19618ce.jpg,w_6a7478d w_1d0e29a w_f03ca16 w_5982299 w_4bd8388
797bd0a3.jpg,w_31d3999 w_9cb2dba w_2d963bb w_0d0ecfb w_22b8a16
3c1f2a3a.jpg,w_11b993a w_0853262 w_4041a7b w_1c69443 w_addcafa
45e8ca42.jpg,w_8c1ec28 w_9875c12 w_59eb8ae w_76599c3 w_522ba14
537307ff.jpg,w_681dba6 w_49308df w_c4e71b6 w_97768ee w_a67a1bc
b4077458.jpg,w_4a38a9f w_4457d27 w_17964ef w_6badfcf w_222dcb7
0409a4de.jpg,w_7b5a630 w_df092eb w_7b035cc w_0ebd514 w_2482b4a
830ecfb0.jpg,w_9ec358c w_4b04829 w_2863d51 w_735d8a4 w_3cf3853
328a24e8.jpg,w_f19faeb w_9e22ded w_86e5d8c w_73d5489 w_27fc5d3
8e225bf9.jpg,w_569c2c7 w_cd4b506 w_ef2f0f0 w_8c618e1 w_ba0d756
3ad46aec.jpg,w_18eee6e w_dc7c5a0 w_3d0bc7a w_591db29 w_2d99a0c
e278c9e8.jpg,w_e082823 w_ba8c7bc w_b4a5677 w_86b9dfd w_54fc5b3
e67f94ea.jpg,w_45b90d9 w_fae3939 w_4bd8388 w_80bae3a w_a9f41fd
ad6f8813.jpg,w_fb2c3fb w_7d19608 w_1c6d5f0 w_430766d w_0c3295a
c061bd6f.jpg,new_whale w_8fab53d w_95b6cc3 w_243e33e w_7e8b270
f0526414.jpg,w_d2b4956 w_79f7d21 w_ade77e6 w_402784d w_9b6b87d
4bac8fdf.jpg,w_599d0df w_b5383b5 w_fd1cb9d w_1a5beb9 w_8c1dab2
34f16ff6.jpg,w_0d2dc7e w_9aeb18f w_c01e25d w_3674103 w_eb0a6ed
472e6da9.jpg,w_33e89be w_3e6a161 w_42dd100 w_bb2d34d w_80171b9
e54928d5.jpg,w_7554f44 w_ffa78a5 w_02b775b w_8b22583 w_d1eab36
a0f22fba.jpg,w_eeb5fa7 new_whale w_76d2cce w_056be75 w_125095f
32db3996.jpg,w_1e45a47 w_681dba6 w_0acce53 w_c4c8491 w_7307089
b45feebe.jpg,w_ddf14ae new_whale w_e05ee50 w_4cff2f8 w_398aa7f
2755f76d.jpg,new_whale w_ddad87e w_27cf4e2 w_d20befa w_15f29b7
d9c9e17c.jpg,w_4fa1bd5 new_whale w_a06bdc4 w_e7a238b w_b96d4e0
79618b7b.jpg,w_12c3d3d w_6ee7470 w_5317c46 new_whale w_219e33c
147040d2.jpg,w_248af0b w_817f022 w_9ceb05d w_3fffc61 w_f4fc8cc
ed296ca4.jpg,w_8a31e6c w_d6df554 w_0c6dbbe w_3d8c865 w_1f10750
9ae35b42.jpg,w_c9e1cdc w_1d4f970 w_1000f90 w_f5771d1 new_whale
1f0f9baf.jpg,new_whale w_ab6db0f w_cbd271b w_15b9665 w_f792125
f2781d4c.jpg,new_whale w_0bbb3de w_d37b55b w_25fdcfb w_684ca15
fe77ce44.jpg,new_whale w_07e92ee w_bde9c34 w_5059889 w_64433af
3c217407.jpg,w_44cccf6 w_c0d494d w_cf00b01 w_23e4e61 w_a3dbc8f
cd616ff6.jpg,w_d76d3bb w_0ea659e w_8ab8687 w_dba0cd8 w_7914111
78da3ecc.jpg,w_1287fbc w_13c6b6b w_540fd73 w_dcb1f2a w_89d9c03
6c48edb1.jpg,w_38e088a w_1274a11 w_72e70e5 w_0ecff13 w_79f5620
93a5c9c5.jpg,w_4378542 w_0740d28 w_c26666e new_whale w_16d1b32
65d9a84d.jpg,w_367b996 w_cef690d w_7554f44 w_f51b4bc w_a59221a
d91d9085.jpg,w_cc009e5 w_d36f58c w_43340c5 w_c5d7c03 w_dff77b6
aead6d86.jpg,w_679f2eb w_ddf14ae new_whale w_8a816b1 w_49c9417
033263d1.jpg,w_434ad6a w_2863d51 w_1d05772 w_e3c1ec4 w_53064a6
f3ee0ed9.jpg,new_whale w_6232813 w_6092d5c w_00cb685 w_ffcd98e
cbaa8714.jpg,w_8643ba3 w_243e33e new_whale w_9c61d57 w_38efce7
b04c9100.jpg,w_fe6617a w_09c1e0b w_217e78a w_2b939eb w_3fc3d07
c523ccba.jpg,new_whale w_ee17a08 w_9c61d57 w_8c1ec28 w_f478955
5a68abcc.jpg,w_a254eb0 w_b4d182b w_88e679c w_1917275 w_5bdb7c2
ca130a09.jpg,w_95c7d1b new_whale w_c128384 w_c551c9d w_b3e6069
e0697e43.jpg,w_b3e6069 w_73d5489 new_whale w_699be3a w_6b2995b
2fad298b.jpg,w_7234b3d w_2250fa9 w_3a9ee71 w_a22f338 w_b4ad62f
bc4cf540.jpg,w_d22af00 w_ba56291 w_d141590 w_1f10750 w_797e546
0cd99488.jpg,w_2fe43c7 w_f4fc8cc w_c8d20aa w_8c1e2e4 w_b3cc032
b74640fc.jpg,w_43966a3 w_fc433f7 w_47d2bc6 w_434ad6a w_43be268
5493b417.jpg,w_2fd21ec w_05e6ba7 w_263e243 w_38954da new_whale
a16b4bab.jpg,w_d88328d w_9d0e84a new_whale w_2d99a0c w_b9c9129
26dda050.jpg,new_whale w_49a3b14 w_76390b4 w_5b1fa1d w_6c42496
334b0a34.jpg,w_1a229eb w_9caed77 w_5d84c65 w_dd8299b w_3572b44
b918924a.jpg,new_whale w_9ea2cc3 w_715d152 w_29cc48b w_3ac13d2
29e9d432.jpg,w_7a53e0c w_2730966 w_c786765 w_97bc172 w_3b99025
ba2daa12.jpg,w_030294d w_59eb8ae w_4ebeafb w_10ace22 w_bb2c317
a386d5a5.jpg,w_7914111 w_1f6e1db w_3e25a26 w_55c9a3b w_96c6151
5b60dea2.jpg,w_3326396 w_6d4dedc w_c0bb183 w_1eafe46 w_b71eab2
efa06b96.jpg,w_8b56cb1 w_53baa9b w_59eb8ae w_3cf3853 w_4dceacc
326b70e9.jpg,w_bdbec6c w_7ab9a17 w_8ec2960 w_dcb1f2a w_3197568
118a681a.jpg,w_ae27ddc w_08d1ccd w_daec6d3 w_21b3754 w_a0fc1a7
c35e131a.jpg,w_7311fe4 w_94cd45e w_3fc3d07 w_5b99089 w_a18d0dc
d955f83d.jpg,w_7600863 w_a8990f1 w_3ce788a w_dc97dc3 w_32475a1
8651beb5.jpg,w_cacfe12 w_24bdae3 w_3b90f9b w_e15442c w_962164f
27330d71.jpg,w_7f6ce8e w_200a203 w_b1d054c w_ec354a5 w_eec1133
e5c7b97d.jpg,w_530f87b w_0dee306 w_e6ced04 w_721d2e9 w_5ee752a
9c4a88bb.jpg,w_9caed77 w_44a6b62 w_ff1b64c w_9948a99 w_55c9a3b
6156671b.jpg,w_0ac9006 w_df21074 w_28cd742 w_a4678de w_7caa4fe
81f3ca75.jpg,w_8103039 w_48bcad8 new_whale w_b678944 w_e685c80
3b9990f7.jpg,w_d663f4f w_14c8f15 w_33e89be w_ba8c7bc w_5f0a14c
6543b1d2.jpg,w_83034c7 w_3d187b5 w_d26cc27 w_7778174 w_55c9a3b
564464c4.jpg,w_c00534d w_4e68ddc w_9a5cd8e w_cce0444 w_1703ee5
e6638231.jpg,w_3197568 w_17ee910 w_24e2654 w_1a70685 w_759b647
f92acf1f.jpg,w_66c1b54 w_71e6583 w_552a16e w_dad23fa w_ffcd98e
f810f98d.jpg,w_cc3a724 w_00c4901 w_c80d300 new_whale w_964ce09
87dcde1d.jpg,new_whale w_d141590 w_899f659 w_ca0ec7c w_a25caa9
7f180ff4.jpg,w_b588283 w_8cd3036 w_3039e7a w_dbbe0d4 w_92d55a6
615549d8.jpg,w_515d21d w_76c2a95 w_636638f w_a8494ea w_1e7bb93
daa2289d.jpg,new_whale w_0bc712b w_d141590 w_09f825c w_c07f119
18b7d686.jpg,w_2fe43c7 w_62f804d w_c8d20aa w_e02fe7b w_6af9dd7
e8ab4e42.jpg,new_whale w_b8dff40 w_4fb3c95 w_d9adb4f w_0e737d0
7d4b12fa.jpg,w_8ecd3a7 w_613723e w_2bba8c8 w_a41d931 w_4d528e4
ced03913.jpg,w_23dce10 w_73d5489 w_5dc1c2d w_78a6f56 w_74011a2
347a1331.jpg,w_1e45a47 w_1e31d24 w_aafa5b5 w_6d7c852 w_5dddfbe
284e1e46.jpg,w_dbda0d6 w_6926f08 w_530f87b w_f8c3a63 w_a16b600
fe3912d4.jpg,w_c06dd6e w_1ac4c38 w_53e9072 w_ebf9290 w_2663598
5d185721.jpg,w_f81c626 w_d428980 w_43be268 w_1dff010 w_06972d2
e995c24e.jpg,w_a3cd405 w_8ba2066 w_59eb8ae w_11f6df1 w_d2be6cc
11564659.jpg,w_ca0ec7c w_3e1bdd0 w_d80e1bc w_15d1235 w_f93d780
0e561e2c.jpg,new_whale w_d88328d w_3bc8a47 w_43be268 w_a1a8680
3c533d05.jpg,w_61d516e w_60cc444 w_addcafa w_0853262 w_2ce5ce2
bd43b2f9.jpg,new_whale w_c6be61e w_f2e9eb1 w_44cccf6 w_fe6f08d
c3f2b5c0.jpg,w_e09d8cf w_75378d3 w_8f776ed w_e5d6443 w_cd22b23
d12533c4.jpg,w_d7de1ee w_52e7cf6 w_02b775b w_c13b4e6 w_72e70e5
b76d70c6.jpg,w_ffcd98e w_552a16e w_00cb685 w_6232813 w_61b87f9
6c2a8304.jpg,w_c2c4f43 w_4b95330 w_7de72c5 w_57c14db w_73d5489
81a23200.jpg,w_a190aff w_1287fbc w_8db45b7 w_8f3cb68 w_ab1c859
62c2b603.jpg,w_e826a6f w_540fd73 w_8f593d4 w_6503ccd w_ff1b64c
cec552c8.jpg,w_dba0cd8 w_a9f41fd w_3050553 w_3f2a05c w_2c19c4a
c3d6e88f.jpg,w_2bea4c4 new_whale w_4ec48a9 w_dd60c18 w_551f5ca
5c2b56ca.jpg,w_4095207 w_1287fbc w_67fecca w_a533837 w_e3fbc27
5c65b9b0.jpg,w_309a2b3 w_8ba2066 w_71c7322 w_c58b474 w_dad56c9
8beb7293.jpg,w_8431164 w_693c9ee w_35b01a5 w_eb0a6ed w_37372db
7b89744c.jpg,w_53f79bc w_c8d20aa w_abe383e new_whale w_bf69a19
485a6dcc.jpg,w_6a78025 w_9122e43 w_8242022 w_32602d9 w_6719a5b
666dcbfa.jpg,w_1ec0481 w_c4c8491 w_c45bfc3 w_5a6d315 w_bf14813
d4709d30.jpg,new_whale w_556df30 w_2952678 w_68820e8 w_38a3f72
135e66d5.jpg,w_1917275 w_a25d46c w_ad87135 w_b4d182b w_392bee3
ae610f33.jpg,w_96c6151 w_9d83b4d w_5d0a13f w_31fb9f0 w_9967edd
52071eaf.jpg,w_9122179 w_8c1e2e4 w_d2be6cc w_16ea0b2 w_4404247
a53cdda5.jpg,w_91b7c58 w_9291cdf w_8e23e4c w_32475a1 w_69a9f72
be303576.jpg,new_whale w_1a70685 w_f3865d6 w_9ec358c w_d4fa6f3
cf874a53.jpg,w_af890ad w_3d2724b w_3da62f8 w_33e7def w_36b6904
a3a15c8c.jpg,w_4759df3 w_f64658b w_2863d51 w_77e1d3f w_9ceb05d
eed7af26.jpg,w_54a5871 w_acff672 w_cd70e8b w_1a5beb9 w_5415fcb
c583b34f.jpg,w_ffda8b2 w_09558d4 w_5a6d315 w_41cd8bc w_206742f
8c5253c0.jpg,w_d224115 w_1392cde w_b71d930 w_8459e39 w_4785de7
c66f7a1c.jpg,w_35063ed new_whale w_a526492 w_37a7f78 w_a8ec52f
ce2414b0.jpg,w_d6df554 w_1a70685 new_whale w_da2efe0 w_208de0e
21e0d9f5.jpg,w_ceffa10 w_9b6d597 w_97eaa0e w_883557a w_fdcfcea
b84f1ac8.jpg,w_2a939eb w_34c4927 w_49bbc79 w_3b3b9b2 w_e80641a
df880bf0.jpg,w_4c8244d w_b47a4a1 w_e082823 w_50729c4 w_72e70e5
24a69c1b.jpg,w_d428980 w_0ebd514 w_3061bdd w_987a36f w_6598219
abc26443.jpg,w_5ba417d w_9c3db0a w_d708c5a w_851a7f4 w_0819271
dba2739e.jpg,w_eb7c39f w_c068ed3 w_dd8299b w_3ce788a w_e15442c
436f533f.jpg,w_a837660 w_fa32440 w_13c6b6b w_759b647 w_5d86f98
298e9c56.jpg,new_whale w_d1917df w_4ae36a5 w_7440549 w_7c9fd46
d6353f08.jpg,w_3af4e73 new_whale w_c8f7bcd w_0740d28 w_dbd28fa
0db26be8.jpg,w_40323ac w_613723e w_8a66718 w_056be75 w_5fcee47
d1c2753b.jpg,new_whale w_55b1d69 w_fd698a3 w_71bfc77 w_acc33ca
8aba05cb.jpg,new_whale w_b7d5069 w_b678944 w_559ce61 w_abe383e
da6a57b5.jpg,new_whale w_bc68c30 w_62c3998 w_80c4153 w_a3dbc8f
cdbb8ebd.jpg,w_21b3754 w_73d5489 w_384e9ca w_d22af00 w_392bee3
a97cce35.jpg,w_4dfe7cb new_whale w_8d5ede1 w_4e52a49 w_29fc831
e0197a66.jpg,w_591db29 new_whale w_2d99a0c w_9d0e84a w_666b072
4a6ec774.jpg,w_3fffc61 w_3090f78 w_d428980 w_933f65c w_01f9086
cb039008.jpg,new_whale w_dcf2001 w_6b03eb4 w_9288973 w_3026ce2
1383eab5.jpg,w_0e4f53c w_04c1951 w_f546b0a w_8b15b96 w_2b4da16
abec0cb6.jpg,w_697c72e w_7dc3fae w_24ad46c w_fcff830 w_4ce0510
3b682f63.jpg,w_e449d3a w_530f87b new_whale w_e09e886 w_02c2248
188336c6.jpg,new_whale w_f763429 w_5b1fa1d w_c20f21c w_e0c6ead
46af91da.jpg,w_9122179 w_c8d20aa w_df7485b w_3449e4f w_977d881
57ce2ffd.jpg,w_d663f4f w_48a98d7 w_f81e77a w_efebfe8 w_b0aed4a
cf34a692.jpg,w_987a36f w_656afeb w_d428980 w_f2e9055 w_1ac4c38
88e9462c.jpg,w_f63d8b0 w_cad1a8d w_96d9eaf w_19ca2c6 new_whale
0bab5849.jpg,w_ceffa10 w_1969a9d w_7d9642c w_ff70408 w_e1431ba
dad9cac9.jpg,w_f8c3a63 new_whale w_2071a4c w_7586198 w_8643ba3
98fce14f.jpg,w_b4d182b w_d2b4956 w_402784d w_3f91e04 new_whale
e9b689bc.jpg,w_048f7a9 w_01c2cb0 w_c39fceb w_8397970 w_cfe35d4
cb0c562f.jpg,w_7637760 w_e0cb9c5 w_fb4d1f1 new_whale w_e88388a
9a6a3266.jpg,w_50db782 new_whale w_9f3e4f4 w_7f4a1f1 w_ddbf533
9a2fcaad.jpg,w_17ee910 w_2cdf820 new_whale w_be32bec w_e61dd6d
1bfa38a3.jpg,w_8ba2066 w_0a97a25 w_434ad6a w_bbf20b4 w_54c00ad
a8c47d2e.jpg,w_227ed79 w_d3a5075 w_4fd48e7 w_57c8da9 w_dc89c4c
84a7428d.jpg,new_whale w_715d152 w_be9bf14 w_b793570 w_cbfbeb4
e23ff7e2.jpg,w_49bbc79 w_f208155 w_b942708 new_whale w_0771d4b
a3601ee4.jpg,new_whale w_d19a884 w_ef7cdd5 w_8327e8d w_9122179
fa90231c.jpg,w_98baff9 w_861cc1c w_721d2e9 w_8c1e2e4 w_693c9ee
7768940b.jpg,w_f104523 w_99365b3 w_c07076c w_288e40b w_2111212
dd0db063.jpg,w_c8728f4 w_2c75202 w_0c8967d w_e2241ce w_e4d3ec3
dae4f0c8.jpg,w_157ba16 w_8103039 w_b2e1722 w_ef2f0f0 w_f478955
90a70887.jpg,w_c30959a w_b41e229 w_e73d83c w_d6e437d new_whale
79deb0ac.jpg,new_whale w_dfd7ee8 w_b8dff40 w_b4a5677 w_d3ed80e
e9dd7dfa.jpg,w_61d516e w_a837660 w_d224115 w_1287fbc w_8b6fd36
f40e9c78.jpg,w_c352046 w_e39dcea w_92d55a6 w_3039e7a w_b588283
c506e843.jpg,w_705e0fb w_5059889 w_83accca w_076daec w_1beadba
71a7f3c6.jpg,w_37223f9 w_d014794 new_whale w_ebff750 w_2d2de1d
34932efd.jpg,w_1287fbc new_whale w_3fe1eb9 w_b942708 w_8d83172
cd63898b.jpg,w_06a6351 new_whale w_e6d0696 w_aa7e5f4 w_5b2bb99
529328fe.jpg,w_d88328d w_19dc50f w_f3bd33a w_0b775c1 w_771136b
5789e8e7.jpg,w_d1bbde9 w_67de30b w_07abdff w_9ec358c w_685466f
a904ccbe.jpg,w_552a16e new_whale w_dad23fa w_771d855 w_a14ccaa
bcf5e2f3.jpg,w_0aae8c1 w_ef2f0f0 w_67de30b w_721d2e9 w_fea7fe6
a880a4ce.jpg,w_ddb4c8d w_449503f w_95dd5d2 w_88f693b w_57a137f
06bcf1df.jpg,w_8397970 w_6d90f45 w_640f91d w_847088b w_750dc93
1a614a58.jpg,w_552a16e new_whale w_e685c80 w_61cf42e w_c6be61e
cfeab383.jpg,w_2f283f3 w_3af4e73 w_c95a0ea w_e86cf21 w_21e178f
4e6860cb.jpg,w_5dcbb74 w_43e45b6 w_5f84b1a w_c068ed3 w_f0fc693
4c3a19e6.jpg,new_whale w_7c7bfb0 w_32a920b w_2cdf820 w_6c803bf
1e8218da.jpg,w_f95ef7c w_88b5d47 w_c102ec3 w_d33c2ed w_effd0ea
5b444386.jpg,w_1743d93 w_2832e90 w_9ea2cc3 w_1274a11 w_6247b2e
1e5529a4.jpg,w_54fc5b3 w_98baff9 w_5f50b5e w_f8cd6b6 w_dad56c9
6d3654f4.jpg,w_71c7322 w_711aaa1 w_d1bbde9 w_d11c53b w_2f6a962
bf988930.jpg,new_whale w_068f5bd w_d345e80 w_e59294d w_a8f9a1e
f99ab51b.jpg,w_d26cc27 w_7600863 w_5054c6a w_aed8c22 w_1c6d5f0
076a9746.jpg,w_e700deb w_a20c1e5 w_2c1dafa w_a74742c w_2cadad2
0db6eca7.jpg,w_f3bd33a w_19dc50f w_e6d0696 w_ba8c7bc w_703e39b
90e7c771.jpg,w_b0e05b1 w_6547e12 w_00cb685 w_22bcbd6 w_4b7b80b
da5443cf.jpg,w_2554558 w_15427c3 w_8ecd3a7 w_2f07b15 w_4b8d0c9
1eafda0a.jpg,w_6c99c53 w_c068ed3 w_dab75ca w_80bae3a w_f60c7e8
6113ad50.jpg,new_whale w_0a97a25 w_ca55545 w_6438b7d w_22bb9b3
b12c4a71.jpg,w_496c4f0 w_777f59a w_e3f7187 w_2dbb0fe new_whale
b629f41f.jpg,w_43b50e5 new_whale w_b3655a6 w_0f54cdf w_89c65ac
b8b61ab5.jpg,w_33973bf new_whale w_640f91d w_48c9deb w_df092eb
878920aa.jpg,new_whale w_1ac4c38 w_bc62c0e w_7bcc2d6 w_2c717fb
1f5e5d21.jpg,w_c133ea8 w_4855bd3 w_3f550fa w_c027e4e w_a3cd405
9797e880.jpg,w_3674103 w_697c72e w_99ad599 w_5f82501 w_eb0a6ed
d2b960e7.jpg,w_c4c8491 w_1ec0481 w_eb5b6aa w_f68d0af w_3e0f25d
a0ce5272.jpg,w_0899118 w_95c7d1b new_whale w_ef6e6a9 w_c128384
3a075a93.jpg,w_5624f08 w_32a920b w_8f3cb68 w_13c6b6b new_whale
7f6cb3d6.jpg,new_whale w_449e238 w_403f92f w_30cf2ca w_a1b985a
6d7f6403.jpg,w_99365b3 w_231a0c8 w_8697f5f w_288e40b w_cd01afb
062f56fa.jpg,w_5966fff w_1431f4b w_dcb1f2a w_bdbec6c w_7ab9a17
354391ab.jpg,w_04c841c w_fcee41d new_whale w_0013924 w_0b7e949
2ea8bd34.jpg,w_f60c7e8 w_e15442c w_cece268 w_44a6b62 w_1d0e29a
1c1de137.jpg,w_e826a6f w_8ba2066 w_f18df18 w_118d911 w_d5ec83f
d7fc990e.jpg,w_fd1cb9d w_4c9d3df w_718ce15 w_38e4aae new_whale
fb4ef85c.jpg,new_whale w_2b443f8 w_251ee17 w_5acfa65 w_ce29d2a
32431f4d.jpg,w_fe95ab8 w_1d53d9c new_whale w_741861e w_886257d
d590329f.jpg,w_13c6b6b w_32a920b w_d676d44 w_a837660 w_b80a9c5
0a3cd4cb.jpg,w_4b47559 w_d36f58c w_67fecca w_92585eb w_e3fbc27
5e88917a.jpg,w_c45bfc3 w_bf14813 w_70e49bc w_e08089e w_f68d0af
98f0b45d.jpg,new_whale w_de4daff w_bd61ca9 w_b8f8e69 w_813c5be
d11cdaff.jpg,w_bc62c0e new_whale w_4fdaa2a w_17e8554 w_ef2f0f0
4c0b668f.jpg,w_434ad6a w_77e1d3f w_9ceb05d w_4cff2f8 w_7185713
5a0a9015.jpg,w_fd1cb9d w_272259b w_44f0fa2 w_4c9d3df w_4f38350
cc5697ce.jpg,w_b0e05b1 w_4b7b80b w_5a1b758 w_4e68ddc w_7e8b270
29a0e470.jpg,w_9a5cd8e w_cce0444 w_e826a6f new_whale w_6232813
0010a672.jpg,w_7ba4b5a w_c95a0ea w_434ad6a w_0a97a25 new_whale
72ac2a7a.jpg,new_whale w_36d665c w_6f211a9 w_9412d1b w_302af0a
675423dd.jpg,new_whale w_95874a5 w_d663f4f w_aed6a9a w_62c3998
8ba3c241.jpg,w_26f9f95 w_a8990f1 w_c5f9e78 w_dd8299b w_0bbb3de
92945af3.jpg,w_b47a4a1 w_ee17a08 new_whale w_fe49bc4 w_bf8c3d2
8d13bf14.jpg,w_9ec358c new_whale w_656afeb w_eec1133 w_516bedb
b3528240.jpg,w_656afeb w_9a967cb w_540fd73 w_2fd21ec w_895c722
02740bf3.jpg,w_edf5f77 w_d141590 w_930bc39 w_25ec80a w_7f199c6
6b0c14e8.jpg,w_684ca15 w_40be51f w_9967edd w_25fdcfb w_5982299
350902a4.jpg,w_68a3df0 w_65428d9 w_5102893 w_1431f4b w_1d53d9c
05ece22a.jpg,w_9146eae w_adb041c w_ca8bfb4 w_0acce53 w_c6bd2bb
7aa1d41d.jpg,w_9b401eb w_0e25cf2 w_00b621b w_402784d w_90f74ae
b5ec8f5c.jpg,w_fd1cb9d w_3dd1a87 w_d382236 w_5d6786e w_67c1b6f
d5713f8d.jpg,w_296749b w_96b697f w_a3cd405 w_3411b9f w_0f96780
64bf16b7.jpg,w_c8728f4 w_43be268 w_cc504e7 w_302af0a w_d02787f
abd74d0a.jpg,w_03c84ef w_86113c4 w_fb8ca1e w_1a29ba5 w_98413c8
58cdebf9.jpg,w_2f283f3 w_4cff2f8 w_98f0e93 w_6092d5c w_434ad6a
c0fa1c25.jpg,w_daf162a w_9288973 w_001ebbc w_6b03eb4 w_8d9c6fc
8f07b10f.jpg,new_whale w_ba56291 w_d47e2e3 w_a155149 w_b9e00eb
78e93e5a.jpg,w_c133ea8 w_f660d7d w_b8dff40 w_8a4b8ef w_0e737d0
3efb7847.jpg,w_d8421c1 w_f9fb9d7 w_423e872 w_2a9727c w_4dd966d
86c71589.jpg,w_3023ee5 w_b96d4e0 w_f02bf23 w_6fcceaf w_2018f6c
fe98dd70.jpg,w_d7de1ee w_7637760 w_eb5b6aa w_a67a1bc w_bf77b13
b4e106f0.jpg,w_1deadd7 w_2725793 w_099ab25 w_c58b474 w_e55a554
6e7f9c1a.jpg,w_9e22ded w_ab4cae2 w_daa4876 w_a18d0dc w_35063ed
e22043d8.jpg,new_whale w_e2e56e9 w_8c408dc w_8e16693 w_38a3f72
93f15f06.jpg,w_18eee6e w_a3cd405 w_d428980 w_f2e9055 w_1743d93
1b9a8e48.jpg,new_whale w_1cca86d w_b970272 w_e685c80 w_a14ccaa
6d724a01.jpg,w_981a39b w_6734e40 w_881f3c4 w_c80d300 w_15f29b7
824f6b84.jpg,w_2fd73d9 w_814a588 w_db3621e w_f478955 w_2e4fecc
1f7c65da.jpg,w_02d7dc8 w_0466071 w_03b5e9a w_a85a3c9 w_e8c4623
b8926b07.jpg,new_whale w_296749b w_a0838d1 w_18eee6e w_53ed912
0015f9b4.jpg,w_3d66298 w_87050a3 w_ff7630a w_8b22583 w_fb89186
26f96663.jpg,w_1a70685 w_423e872 w_3f8f5aa new_whale w_d6df554
3418204d.jpg,w_cf3a12e new_whale w_0ecff13 w_37374fa w_3694c7d
6dbdf165.jpg,w_f9fb9d7 w_b31d830 w_67de30b w_715d152 w_c027e4e
83d6e7c2.jpg,w_50db782 w_c8bf168 w_7538a4c w_4057481 w_b47a4a1
55a501b0.jpg,w_5297ab3 w_e4f1fcc new_whale w_37223f9 w_23dce10
ab1f9940.jpg,w_4e68ddc w_e826a6f w_0b04c08 w_434ad6a w_b0e05b1
02bea56b.jpg,w_7e8b270 w_5436d75 w_5cef366 w_fe95ab8 w_d22af00
4b8a75ce.jpg,w_e685c80 w_74e15fc w_a14ccaa w_8a4b8ef w_02facde
227652fb.jpg,w_8ecd3a7 w_34c8690 w_1f2a32a w_e98432b w_addcafa
2739a0e5.jpg,w_72e70e5 w_d76d3bb new_whale w_37374fa w_d663f4f
6eb28a59.jpg,w_97f5054 w_19aeb9c w_e2d0aaa w_94cd45e w_7dee51b
c2472a0a.jpg,w_1969a9d w_ab4bd59 w_db93738 w_3222bdb w_41cd8bc
05dc49c5.jpg,w_2216a46 w_5cef366 w_fd1cb9d w_86ff8a6 w_33c3ce1
07cab0c7.jpg,w_9ea2cc3 w_11adaae w_dc7c5a0 w_5f0a14c w_44ef2b8
5808d7a7.jpg,new_whale w_dd90e0a w_9d136ff w_2fd21ec w_bc62c0e
2d477d1b.jpg,w_693c9ee w_e55a554 w_cf3c233 w_770eb84 new_whale
05b21b0e.jpg,w_16ea0b2 w_b8236d6 w_c529cf1 w_974c0ea w_be4d5b8
1135131b.jpg,w_1489751 new_whale w_f83b1f9 w_4c8e7ae w_ebe0ad5
572a97a3.jpg,w_db93738 w_3326396 w_c6bd2bb w_90201e3 w_ed5cdab
0826a0f9.jpg,w_4855bd3 w_43be268 new_whale w_8dddd45 w_fba3bde
1af482ad.jpg,w_c128384 w_85755f7 w_5af7a9c w_ebf3f26 w_7dc3fae
64b07dc2.jpg,new_whale w_c26666e w_e603cc5 w_cb7b682 w_e33bb21
34cd64a5.jpg,w_83f0b3f w_8f50a1f w_63d10a1 w_7b770ec w_d224115
88d95a67.jpg,w_bd61ca9 w_f4ac89a new_whale w_a2564cf w_de4daff
4512387c.jpg,new_whale w_587d2e3 w_c9e1cdc w_cc009e5 w_38e4aae
65702755.jpg,w_cddb3f4 w_e4f1fcc w_9434f0c w_b454f70 w_4a9ee0f
a25a6f84.jpg,w_73e1d5b w_10ace22 w_211aa88 w_93b64e9 w_0337aa5
7a847c8d.jpg,new_whale w_a59905f w_9ea2cc3 w_e02fe7b w_6556c5c
1c06e68d.jpg,new_whale w_b9ee5ec w_f21f2ec w_17ee910 w_3d0bc7a
79d816fe.jpg,w_cece268 w_45b90d9 w_0fa8587 w_c06dd6e w_1161030
7f74b2f8.jpg,w_3061bdd w_296749b w_0ae998f w_9c4bb3c new_whale
a4a5c27a.jpg,w_5ae47d9 w_49c640f w_cf669dc w_5a81425 w_48f0410
37914615.jpg,w_d8f0f46 w_e45bc18 w_95dd5d2 w_f9038ed w_883557a
439f5058.jpg,w_68b47a1 w_f0b4252 w_6c7bd1c w_6249f5d w_56b9dcd
cc990e82.jpg,w_0c6dbbe w_43340c5 w_9db9ef5 w_2a939eb w_6b03eb4
78ea33a2.jpg,new_whale w_dd086b2 w_09e0cbf w_5c0e858 w_f208155
ada7f21a.jpg,w_1a70685 new_whale w_8d91f88 w_656afeb w_44f0fa2
9cf4ca9b.jpg,w_1489751 w_afe953f new_whale w_f1457b5 w_f19faeb
12b6600c.jpg,w_76b6f7c w_09dd18c w_95dd5d2 w_79774a5 w_7427ace
94a18287.jpg,w_1e75406 w_8ebb024 w_0fea5a3 w_60d8778 w_d6e5334
6eda986c.jpg,w_01a51a6 w_9cb529f w_96b697f w_aae82f8 w_1dff010
105f6623.jpg,w_1d05772 w_4fdaa2a w_51969d2 w_613723e w_2d2d7fe
8ff3fb62.jpg,w_895c722 w_bc62c0e w_bf8c3d2 new_whale w_b7d5069
cb1bdc34.jpg,w_286ec5f w_a2b3d53 w_e86cf21 w_a59905f w_05b2ddd
6cc6d83b.jpg,w_b6886e5 w_3061bdd w_ef2f0f0 w_6710cf8 w_dd90e0a
b25afc0c.jpg,w_d6856ab w_9e4a26f w_17dc953 w_e8d0bac w_5557280
097267e2.jpg,w_1a70685 w_fd1cb9d w_3b3b9b2 w_38e4aae w_20e863f
2e7687ac.jpg,w_85f9040 w_7c7a78c w_813c5be w_fd07344 w_17ee910
065d4e20.jpg,w_7459706 w_38b1edd w_5d4facb w_5966fff w_7d19608
952e3072.jpg,w_c10ffe9 w_fda4fc5 w_0626e4d w_00cb685 w_cbedcb0
9bc0a286.jpg,w_0853262 w_6d17527 w_77607b5 new_whale w_553bb6e
3f1ecbc5.jpg,new_whale w_2b930da w_61d516e w_0988bbb w_a24f581
068386dc.jpg,w_5d96ba4 w_7a53e0c w_29eb3b2 w_ee23a5f w_1ec0481
a4899b85.jpg,w_dba0cd8 w_06f0fd3 w_0aae8c1 w_79f5620 w_3050553
0dec0bf5.jpg,new_whale w_e7aa703 w_125ba17 w_f0d8be1 w_38158d6
abaabc98.jpg,w_9122179 w_540fd73 w_b066aa6 w_1287fbc w_3f907d6
3326b8d2.jpg,w_57c8da9 w_a7d4668 w_3fc3d07 w_30f095d w_0de84f0
8d6fd556.jpg,new_whale w_d20befa w_e863419 w_5acfa65 w_7394d75
9f5c17d2.jpg,w_f0af1f8 new_whale w_e6f5e09 w_5bb7ae9 w_0e0e856
176bf518.jpg,w_026fdf8 w_76599c3 w_693c9ee w_f18df18 w_67de30b
ebf567e8.jpg,w_98f0e93 w_7104905 w_7cca153 w_47d2bc6 w_b678944
afec0623.jpg,new_whale w_243e33e w_9321960 w_bf4880a w_6f504c0
b0251917.jpg,w_49bbc79 w_f208155 w_b942708 new_whale w_0771d4b
46b7ea37.jpg,w_eb9ab29 w_0245a27 w_db0ad01 w_8a997b8 w_7e8305f
3cc8e2eb.jpg,w_741861e new_whale w_9d136ff w_87050a3 w_6d17527
e6508457.jpg,new_whale w_8e3ebeb w_243e33e w_fd07344 w_2a18a44
73b850c0.jpg,w_e4f1fcc w_699be3a w_3674103 w_88b5d47 w_e8d0bac
46a4eb91.jpg,w_d663f4f new_whale w_ba8c7bc w_703e39b w_62c548b
d67afdb2.jpg,w_4696a5a w_c6b5519 w_eb8429c w_e74980b w_d775542
38838870.jpg,w_8719b04 new_whale w_0ee4d6d w_43be268 w_18eee6e
f8f44310.jpg,new_whale w_5d8c038 w_73d5489 w_a71aa99 w_0626e4d
deed5a98.jpg,w_37223f9 w_b55242e w_b454f70 w_037955e w_cddb3f4
3cfafcdb.jpg,w_dd90e0a w_0819271 w_7311fe4 w_b9e00eb w_243e33e
cefcef2d.jpg,w_9236aac w_4f37147 w_0c70bc3 w_fad83c7 w_a048f26
dca6b8fb.jpg,w_bc7e06a w_1f10750 w_900fab7 w_c1c73c0 w_7de72c5
706e3131.jpg,w_43be268 w_a59905f w_1cca86d new_whale w_9d704ab
7cbe5eb4.jpg,w_3674103 w_f8cd6b6 w_6c23fcc w_eb0a6ed w_9948a99
a146fa81.jpg,w_1d96560 new_whale w_ddad87e w_b5c9946 w_27fc5d3
a588b8c4.jpg,new_whale w_1a70685 w_17ee910 w_1287fbc w_b729b1f
77cecd91.jpg,new_whale w_1a4f16e w_e282300 w_7a892ea w_0e40867
3ff016bd.jpg,w_d19a884 w_70a31ce new_whale w_9c3db0a w_73c9ba2
7b44f7ce.jpg,w_dace6e9 w_9e22ded w_2a6d006 w_3621c49 w_b318111
1435a54c.jpg,w_515838e w_dbda0d6 w_22bcbd6 w_25d7f93 w_e3c119c
6f9cf06a.jpg,w_28fa29e w_395f5e7 w_4ec7c66 w_9688819 w_a0ae961
16b2679b.jpg,w_98baff9 w_67de30b w_6c803bf w_bbf20b4 w_e02fe7b
b62cb9ea.jpg,w_c87651d new_whale w_93aee9e w_ba332ae w_ca5f17f
646b3a4b.jpg,w_ef52dd3 w_5d732da w_fd587bc w_4a074b8 w_1969a9d
224483cd.jpg,w_6635a97 w_09e0cbf w_e6d0696 w_a494171 new_whale
78904c0f.jpg,new_whale w_da63cba w_bbcafb8 w_9072f07 w_e6f746e
ddbec211.jpg,new_whale w_6ae7a93 w_d62128e w_ed8a846 w_686408a
62a25948.jpg,w_2071a4c w_1c22d7e w_91572bb w_f83b1f9 new_whale
894a3720.jpg,w_bb2d34d new_whale w_18eee6e w_1aea445 w_3b5403b
27fbe0f5.jpg,w_dc89c4c new_whale w_97f5054 w_38158d6 w_c926fc3
