Image,Id
d1dc3919.jpg,w_5c62a56 w_0e737d0 w_0fea5a3 w_d9adb4f w_73d5489
accbb977.jpg,w_560661c w_b5d8846 w_f03ca16 w_d6d502a w_25d7f93
dd12d4c9.jpg,w_d66572d w_f8aacbd w_842623c w_f843a8d w_1969a9d
e99a54f1.jpg,w_0988bbb w_b2b073b w_2527790 new_whale w_91b5f87
cde23f50.jpg,w_4b16688 w_0466071 w_6abc013 w_8fac7da w_d4bc10d
77b375e7.jpg,w_eea20c4 w_ace8c54 new_whale w_e964ae8 w_d663f4f
4f3616f4.jpg,w_f0fc693 w_98baff9 w_8c1e2e4 w_861cc1c w_dc89c4c
ba0b6931.jpg,w_026fdf8 w_b4369cc w_4403803 w_c4c00ed new_whale
abe9b2c1.jpg,w_9ea2cc3 new_whale w_b729b1f w_18eee6e w_cf00b01
4e9c0341.jpg,w_c551c9d w_93a4f60 w_dbc392b w_081dd6e w_e8a8d85
fe6884f6.jpg,w_1948625 new_whale w_c8f7bcd w_f5771d1 w_ab6db0f
89beec00.jpg,w_54c00ad w_7185713 w_eb0a6ed w_211aa88 w_711aaa1
63092b63.jpg,w_b96d4e0 w_434ad6a w_d96a0cd w_0f96780 w_53064a6
32bdef7b.jpg,w_da2efe0 w_f5b8faf w_8a1ab00 w_fc7cc24 w_43b50e5
199354b8.jpg,w_5c6215c w_70daaba w_24fda6e w_e826a6f w_25db560
c7ca64d4.jpg,w_98baff9 w_861cc1c w_654a5bb w_721d2e9 new_whale
49637c24.jpg,w_fe49bc4 w_8fab53d w_d663f4f w_3d66298 w_ee17a08
d158855f.jpg,new_whale w_009dc00 w_0e32aa2 w_b8cba61 w_179ffe3
ee6aef6b.jpg,w_3023ee5 w_1287fbc w_78f2e92 w_5624f08 w_f400702
063b8988.jpg,w_bc9dc37 w_2fe43c7 w_e61dd6d w_d5ec83f w_db2baec
f1cc7fae.jpg,w_f1396bd w_73d5489 w_c01e25d w_a232f9e w_5297ab3
308be740.jpg,w_62799b5 w_53549df w_e55a554 w_1d17e8c w_8ecd3a7
c2ca6d9e.jpg,w_883557a w_ddbf533 w_e3c119c new_whale w_f099dc8
00dfd1df.jpg,new_whale w_e8a8d85 w_f0d8be1 w_eb0a6ed w_93a4f60
3a450687.jpg,w_fd6e8d2 w_b6c0c65 w_0ea659e w_dba0cd8 w_b197b5c
5d4e469e.jpg,w_5d4facb w_7d19608 w_38b1edd w_705e0fb w_bde9c34
71abca06.jpg,w_5dddfbe w_8c1ec28 w_7bdfc11 w_92d390e w_9b3ed01
c21cf77c.jpg,new_whale w_d78513b w_06b6f60 w_56743d6 w_0c8a724
680d9057.jpg,w_8e451d9 w_a913945 w_a66b2a5 w_3449e4f w_13c6b6b
a2929d0f.jpg,w_2dae424 new_whale w_c39fceb w_6d90f45 w_02a768d
90af50ef.jpg,w_59eb8ae w_5415fcb w_37372db w_3add848 w_693c9ee
28c30ef2.jpg,new_whale w_bc9dc37 w_987a36f w_0408054 w_11adaae
2c8791c7.jpg,w_ffa78a5 new_whale w_d2324e2 w_b48535f w_25871da
e6d9cc0a.jpg,w_ff7630a w_569c2c7 w_7554f44 w_87050a3 w_67de30b
a7b31d8b.jpg,w_e826a6f w_fba3bde w_4e68ddc w_9c70a11 w_0a97a25
faf7aed1.jpg,new_whale w_6a87d0d w_243e33e w_23526cb w_e9f85b7
6fd2870b.jpg,new_whale w_2554558 w_79d4855 w_b9ee5ec w_0f96780
2207146c.jpg,w_1d05772 w_77e1ae3 w_af5d11a w_bbf6ebf w_1c69443
78c4c071.jpg,w_73d5489 w_d8f0f46 w_0e4f53c w_303518a w_a8ec52f
9321bc2b.jpg,w_434ad6a w_e3caa40 w_67de30b w_1d53d9c w_b074cdf
1a539580.jpg,w_7e48479 w_7f45825 w_ccbc782 w_c48ad3e w_b835ae1
84e0649f.jpg,w_1ac4c38 w_67de30b w_bb37d93 w_817f022 w_79b12d8
ecf07b35.jpg,w_8936f42 w_4b950da w_b440303 w_cece268 w_2811cea
ba00fd36.jpg,w_0c6d50d w_eb0a6ed w_3f91e04 w_ddbf533 w_f0f0dbb
44841d2e.jpg,w_ff7630a w_1854334 w_0a97a25 w_87050a3 w_223cebd
40bdf228.jpg,w_367b996 w_04c841c w_c7b05e7 w_bbd9409 w_53ed912
920cdee7.jpg,w_d014794 w_3326396 w_90201e3 w_0bbb3de w_83a922d
cca5c937.jpg,w_c352046 new_whale w_5c59d12 w_33973bf w_c829019
a499da9d.jpg,w_3b5403b w_398aa7f w_a59905f new_whale w_e2e56e9
e05c3e7e.jpg,w_eb8429c w_40cc259 w_c7b05e7 w_1d05772 w_bbd9409
8a2caf51.jpg,new_whale w_33c3ce1 w_e449d3a w_af6c7e2 w_04c1951
77194476.jpg,w_5f82501 w_883557a w_a26a029 new_whale w_18a1bf2
033e77b1.jpg,w_be3c0f5 w_9c449e2 w_120927e w_491607b w_72e70e5
3fb88d12.jpg,new_whale w_b4151b7 w_d4bc10d w_8309df3 w_a190b3b
8249f4b1.jpg,w_b604c18 w_23b9dcb w_2c19c4a w_10bea88 w_e15442c
ec333fd4.jpg,w_9a967cb w_e655c65 w_2fd21ec w_f81e77a w_c00534d
a27eeace.jpg,new_whale w_68820e8 w_a30882c w_0da6f67 w_1703ee5
3f880c85.jpg,w_61d516e w_5ee752a w_0853262 w_addcafa w_60cc444
8aad3140.jpg,w_55647bd w_37223f9 w_af8cad1 w_78a6f56 w_2d2de1d
47cd0f07.jpg,w_dd76ce2 w_a25caa9 w_ef52dd3 w_cacfe12 w_962164f
e2eb5bd3.jpg,w_e8a8d85 w_34c8690 w_85755f7 new_whale w_4b95330
33c117a7.jpg,w_e6ddfe1 w_e44d512 w_993d66c w_212b985 w_2f6a962
e5b5b78c.jpg,new_whale w_20c671c w_d02787f w_c8728f4 w_11138db
aaed6b1c.jpg,w_78a6f56 w_37223f9 w_96c6151 w_dbc392b w_cddb3f4
65387be7.jpg,w_a14ccaa w_9c4bb3c w_06972d2 w_9875c12 w_b6886e5
2224a2b0.jpg,w_7185713 new_whale w_9ceb05d w_61b87f9 w_7049d9f
37b1bd84.jpg,w_2901dbf w_516bedb w_272259b w_0e81e60 w_16ea0b2
cf341a44.jpg,w_76d2cce w_861cc1c w_8f593d4 w_c053b99 w_b96d4e0
29df6017.jpg,w_44cccf6 w_ccc8e31 w_fe6f08d w_e156c87 w_73b26b7
267bf302.jpg,w_abe383e w_654a5bb w_693c9ee w_6de53d1 w_9ceb05d
fc873bc4.jpg,w_d6d502a w_d2b4956 w_7cca153 w_2ac83b0 w_214c09a
f7d20855.jpg,w_1f10750 w_37a7f78 new_whale w_c0a4c9d w_d3c8520
cacef5a8.jpg,w_f478955 w_40323ac w_efbb71a w_5a5c560 w_ddbf533
e65918ea.jpg,w_87782a0 w_d984eb7 w_97da401 w_2dae424 w_1d53d9c
2d986ef8.jpg,w_224000c w_8069cbb w_4a9ee0f w_79b42cd w_593485f
2a849809.jpg,w_0a97a25 w_8ba2066 w_cef690d w_87050a3 w_77e1d3f
78dffb10.jpg,new_whale w_8c1ec28 w_1703ee5 w_08f1502 w_3e26a99
a77ad1c3.jpg,w_ae07541 w_62c3998 w_29fc831 w_9d0e84a w_32a920b
5d6f71eb.jpg,new_whale w_3664a22 w_e02fe7b w_ba8c7bc w_6c803bf
7c19e299.jpg,w_2e872af w_452400e w_5a81425 w_18a1bf2 w_dc4c2ba
274a7962.jpg,w_851a7f4 w_44a6b62 w_977d881 w_f8e6546 w_eb0a6ed
b7106760.jpg,w_1703ee5 w_711aaa1 w_d1bbde9 w_4b04829 w_7f6ce8e
d82b89c9.jpg,w_edcb241 w_06ff732 w_c06dd6e w_1ec0481 w_15d1235
ab428c2b.jpg,new_whale w_293b5e4 w_010a1fa w_8c30867 w_1e6559e
6556e2d9.jpg,w_f208155 w_43be268 new_whale w_28ce17c w_aae82f8
e902c27b.jpg,w_95c7d1b w_0899118 w_c128384 w_e449d3a w_85755f7
16542a08.jpg,w_0c6dbbe w_17e592c w_fd587bc w_5d732da w_99c07e8
8e135404.jpg,w_0f96780 w_53064a6 w_7f40920 w_53ed912 w_0aae8c1
c0ca9eda.jpg,w_bc9dc37 w_4684a3f new_whale w_3d4900b w_7c7a78c
3f041163.jpg,w_af5d11a w_8861715 w_77e1ae3 w_c027e4e new_whale
a66915d1.jpg,w_e7e6ef2 w_68a7146 w_1e6559e w_67bfdf5 w_711d58c
617561e9.jpg,w_3674103 w_c0d494d w_62799b5 w_eb0a6ed w_7946258
b4487aca.jpg,w_08f1502 new_whale w_9948a99 w_03a2ed7 w_5d8c038
3a2f7478.jpg,w_8c408dc w_ee94c57 w_e2e56e9 w_2ac069f w_be9bf14
cff43979.jpg,w_79d4855 w_c0cfd5b w_a59905f w_44fc081 w_37bd99a
c826ee6d.jpg,w_67bfdf5 w_5824675 w_1a4f16e w_c84409b w_7440549
8d36cb9a.jpg,w_bccfcc1 w_19ca2c6 w_5e78545 w_c241e72 w_c9dd32e
32f14f62.jpg,w_e61dd6d w_2fe43c7 w_bf8c3d2 w_987a36f w_6092d5c
7cf83313.jpg,w_d6255a4 w_c4c8491 w_cbedcb0 w_29670e2 w_49308df
16843cf1.jpg,w_2663598 w_d32adcd w_c06dd6e w_06ff732 w_c1c73c0
02bc3885.jpg,w_2b0028d w_037955e w_efebfe8 w_3b99025 w_b9e00eb
980f3c8f.jpg,w_d5f0261 w_d89b29e w_a2a1378 new_whale w_e6ddfe1
18a0eb3b.jpg,w_1287fbc w_b942708 new_whale w_dfec7a3 w_c9e1cdc
5fb06ea4.jpg,w_056be75 w_4c8244d w_b47a4a1 w_1eafe46 w_398aa7f
ad365622.jpg,w_0e9f6d9 w_451f507 w_f3865d6 w_6202983 w_900f9eb
30c8c1c7.jpg,w_7c7a78c w_63db6f9 w_eec1133 w_3af4e73 w_c3d523d
05b23512.jpg,w_9ca943b w_e62a48d w_fd07344 w_4659acf w_0a97a25
ad7075ab.jpg,w_0e737d0 w_1dff010 w_f478955 w_7759db0 w_41a79d7
1f12ddfe.jpg,new_whale w_c34afd7 w_0fecdf7 w_656afeb w_976a54b
e2822a29.jpg,w_60cc444 w_2ce5ce2 w_0853262 w_b5383b5 w_0dee306
1f190e76.jpg,w_b729b1f new_whale w_3fc8361 w_7f40920 w_2a939eb
a570749f.jpg,w_ff7630a w_2b0028d w_dbda0d6 w_7554f44 w_434ad6a
69dbab11.jpg,w_3326396 w_f95ef7c w_31fb9f0 w_d33c2ed w_c0bb183
e64baa7b.jpg,w_7248590 w_654a5bb w_02a768d w_ed3bd5b w_eb0a6ed
2d6e85e7.jpg,w_90201e3 w_d014794 w_db93738 w_5fbef36 w_c6bd2bb
4f4a2111.jpg,w_eff7e35 w_06ff732 w_d32adcd w_c06dd6e w_76048fe
413167bd.jpg,w_65efe4d w_2085f2e w_45b90d9 w_6df35bf w_95aad92
bba918c3.jpg,w_5fc5ea5 w_17e592c w_3e25a26 w_fd587bc w_feab6f3
62534261.jpg,w_98baff9 w_b074cdf w_52b0438 w_f0fc693 w_861cc1c
0167d802.jpg,w_11adaae w_48a98d7 w_7ba4b5a new_whale w_78999a6
b48c5580.jpg,w_93b64e9 w_fb2c3fb w_80c692d w_fd1cb9d w_f44277f
9c814a76.jpg,new_whale w_dcb1f2a w_85f9040 w_fae2cb6 w_4c8e7ae
48c6d0f4.jpg,w_03f060f w_a1237e3 new_whale w_f03ca16 w_7276f4b
7f8f5a11.jpg,new_whale w_89e159a w_96c141f w_1a70685 w_64f3545
d5edc9f4.jpg,w_afc7d61 w_2730966 w_e4df90a w_3a9ee71 w_740dfd4
b4e7115a.jpg,w_2ac069f w_96d9eaf w_ed10a36 w_5e78545 w_46b211d
511c84f5.jpg,w_1596a47 w_479e3e5 w_8db45b7 w_77607b5 w_eb8429c
9802098b.jpg,w_5f82501 w_a190aff w_5dddfbe w_6d7c852 w_8c1ec28
4cdaa954.jpg,w_9e22ded w_a5c5f2d w_fce6ab2 w_8bdc211 w_59db39b
6d9d0b3a.jpg,w_d382236 w_dc7c5a0 w_8464638 w_76387b4 w_38e4aae
ed7e74af.jpg,w_ffa78a5 w_38158d6 w_85cdd9b w_95b6cc3 w_3f12226
625b9d11.jpg,w_73d5489 w_4fb3c95 w_2b443f8 w_0e737d0 w_c0a4c9d
bc542634.jpg,new_whale w_4e03f66 w_3cbccb7 w_49308df w_a67a1bc
976698f1.jpg,new_whale w_741861e w_aa7e5f4 w_2a18a44 w_dfd7ee8
e775d25f.jpg,w_d6a6360 w_f0f0dbb w_1969a9d w_8bdd984 w_cc5fae7
f539fedc.jpg,w_735ce7d w_00d8453 w_38bcd3e w_a965f14 w_6121036
76c11a56.jpg,new_whale w_b2d937a w_bda2856 w_49b425b w_ebf3f26
277734a7.jpg,w_adc62bc w_741861e w_eb458bf w_2d29ddd w_72b0d7f
ad10f81b.jpg,w_037955e w_31fb9f0 w_f0fc693 w_f95ef7c w_aa16da4
25683268.jpg,w_569c2c7 w_434ad6a w_8ba2066 w_0a97a25 w_18eee6e
270b5d29.jpg,w_f2b0e93 w_76106aa w_c58b474 w_ada188f w_db2baec
8baa3f5d.jpg,w_7a53e0c w_d937660 w_c786765 w_0e4f53c w_63d10a1
44e5901e.jpg,new_whale w_af890ad w_7276f4b w_83714b7 w_6e26345
1849e785.jpg,w_0e9f6d9 w_b6689cc new_whale w_21745f8 w_de3cab3
2a9e2c0b.jpg,w_5297ab3 w_219e33c w_09f825c w_12c3d3d w_23dce10
2b20e5e4.jpg,w_1d0e29a w_02a768d w_29670e2 w_2dae424 w_f0fc693
cafcf1e6.jpg,w_1febbf3 w_0d48a7d new_whale w_5af7a9c w_ade77e6
79d8d3b1.jpg,new_whale w_778ee6e w_398aa7f w_cd88a48 w_03a2ed7
b962cbb9.jpg,new_whale w_b1d6681 w_53549df w_d49402a w_028ca0d
19d16715.jpg,w_861cc1c w_f8cd6b6 w_42f935c w_98baff9 w_05567a9
10a0d727.jpg,w_17ee910 w_56bbc91 new_whale w_d4eb9ed w_dbaa2b1
09a796f2.jpg,w_cfe35d4 w_8397970 w_6d90f45 w_b426ff3 w_8242022
1ff136ec.jpg,w_c0d494d new_whale w_0771d4b w_49bbc79 w_dcf2001
b59a3125.jpg,w_45461e6 new_whale w_93a4f60 w_38158d6 w_cf8b725
0da99e00.jpg,w_6092d5c new_whale w_5b672ea w_bf69a19 w_b2ba967
0538b4cf.jpg,w_ef2f0f0 w_ca55545 w_02bb4cf w_9f3e4f4 w_41da937
db010fc1.jpg,new_whale w_c01beb7 w_0f16be3 w_cf8b725 w_93b64e9
c33144e2.jpg,w_5b99089 new_whale w_b6689cc w_945aefe w_eb39613
d7531cbd.jpg,w_01b2250 w_56bbc91 w_64f3545 w_4e52a49 w_4c9d3df
d4bb64b9.jpg,w_b4eeae6 w_524f51e w_e1f55ad w_6b45921 w_25871da
2448f674.jpg,w_eec1133 w_44cccf6 new_whale w_650bd05 w_fe6f08d
1c9aee17.jpg,w_05ec84e w_3e25a26 w_c053b99 w_c5f9e78 new_whale
ea9e91fb.jpg,w_c9e1cdc w_0beef28 new_whale w_b0b275e w_654a5bb
522e9a99.jpg,w_53064a6 w_3349c9d w_8dddd45 w_54b0844 w_82ec5f0
bdbf742d.jpg,w_55c9a3b w_5fc5ea5 w_f79b3f9 w_ef52dd3 w_c068ed3
e3dc2020.jpg,w_059e347 w_38158d6 new_whale w_cf8b725 w_d96a0cd
df1ac5ef.jpg,w_ffda8b2 w_4103f39 w_096bc48 w_206742f w_430766d
981a7046.jpg,w_9967edd w_2184d07 w_684ca15 w_cddb3f4 w_dace6e9
133ab30b.jpg,w_a7202e1 w_29d2cec w_471cca4 w_43be268 w_1eafe46
1c10ade8.jpg,w_eb0a6ed w_3f91e04 w_f8e6546 w_886257d w_c0a4c9d
e17e0956.jpg,w_0ebd514 w_0beef28 w_7b035cc w_c133ea8 w_6598219
23a1ae27.jpg,new_whale w_b96d4e0 w_8c1e2e4 w_861cc1c w_96fd936
80ed3ae7.jpg,new_whale w_db2baec w_fd1cb9d w_f4fc8cc w_3f8f5aa
b7621404.jpg,w_fa32440 w_a7d4668 w_3f12226 w_8cf18ac w_72d5b6c
0466a76a.jpg,w_42cc88d new_whale w_4c9d3df w_816d344 w_dbaa2b1
ec613e94.jpg,new_whale w_da2efe0 w_deb33de w_63db6f9 w_cd3e1bd
d09346a5.jpg,w_402784d w_9b6b87d w_490b224 w_f6fb689 w_30f095d
faaa92a5.jpg,w_db0ad01 w_80bae3a w_b197b5c w_dba0cd8 w_5dcbb74
f4f85800.jpg,new_whale w_82e0d98 w_27633c3 w_e62b5d8 w_639aed5
f5d69e73.jpg,w_f70f725 new_whale w_33973bf w_7bf3a5c w_64f3545
44daedba.jpg,w_2eabd5a new_whale w_326e389 w_3c0bbac w_c84409b
605c5776.jpg,new_whale w_8f1aa27 w_1deadd7 w_23d3818 w_1eff98a
bd4dd941.jpg,w_5054c6a w_23e5a4c w_1e7bb93 w_ab039e2 w_5d0666e
909a5336.jpg,new_whale w_2d25d1f w_0b3f313 w_d430a71 w_2c46a73
0ce32a2b.jpg,w_79f5620 w_06f0fd3 w_2c19c4a w_e700deb w_826eb44
4051a842.jpg,w_2c1dafa w_e08089e w_2fdf63b w_5f84b1a w_c87b956
c9030187.jpg,w_f660d7d w_7427ace w_9c4bb3c w_f18df18 w_12f2352
120b2a6c.jpg,w_bb2d34d new_whale w_813c5be w_17ee910 w_3d0bc7a
a29c7619.jpg,w_a254eb0 w_37f17ad w_9aeb18f w_8c1ec28 w_ca5f17f
2b8c566c.jpg,w_7554f44 w_97da401 w_b074cdf w_243e33e w_c66638b
e3c50fcd.jpg,w_6c803bf w_71c7322 w_a3cd405 w_7b5a630 w_07abdff
f2e53dd4.jpg,w_eb0a6ed w_98baff9 w_330f897 w_19a5685 w_ec27074
a0fdeee7.jpg,w_8f1946f w_479e3e5 w_c26b92a w_8db45b7 w_fcf5284
e374bdbd.jpg,new_whale w_c1b685f w_7276f4b w_ea99623 w_0ead9d7
5148671d.jpg,w_414c24a w_83df8d5 w_a4678de w_515d21d w_53e9072
6be1c8f2.jpg,w_a8ec52f w_dd0c2e0 w_37a7f78 w_e62680c w_578a509
d83605e3.jpg,w_b283b00 w_1ac4c38 w_e0e5c9e w_91c0a1d w_147b62b
dfddd2b8.jpg,w_29f00ae w_6c42496 w_4875b75 new_whale w_f104523
c7254bde.jpg,w_fcfcf68 w_2bb8c37 w_29eb3b2 w_83d8a2e w_1ec0481
8d20f661.jpg,w_dc001f8 new_whale w_64f3545 w_8ea1699 w_a2eb1bb
09f90f96.jpg,w_d382236 w_e80641a w_462a117 new_whale w_89d9c03
0a566a21.jpg,w_56f2b1e w_03dc41c w_ca8bfb4 w_9cb2dba w_fd587bc
93324381.jpg,w_f660d7d w_8f593d4 w_656afeb w_9c4bb3c w_8201aa8
c0e51022.jpg,w_8b56cb1 w_51969d2 w_e74980b w_d465e44 w_6503ccd
f3bddb9b.jpg,w_1eaebf2 w_410142f w_9615cf1 w_fea7fe6 w_dd76ce2
b2eb0337.jpg,new_whale w_0a91f24 w_293b5e4 w_14c8f15 w_e73c666
4e4062ec.jpg,w_76ebad6 w_186bcab w_6ab7b53 w_b9e00eb w_f10006a
90d9fcee.jpg,w_94e1ed4 w_ef2f0f0 w_c708776 w_8b56cb1 w_19c005a
8b188253.jpg,w_96d9eaf w_f63d8b0 w_bccfcc1 w_f188f95 w_a254eb0
e88055b2.jpg,w_55647bd w_db93738 w_ef67a6c w_6f2309d w_b71eab2
5066368c.jpg,w_6af9dd7 w_06a6351 w_2a939eb w_c0d494d new_whale
8334ff79.jpg,w_62ca7c8 w_dbda0d6 w_0de84f0 w_8643ba3 w_4b7b80b
401bd05f.jpg,w_2f54c3c w_f0f0dbb w_f8cd6b6 w_4fb3c95 w_73d5489
5761b9d9.jpg,new_whale w_49bbc79 w_89e159a w_f208155 w_3411b9f
41609ec9.jpg,w_d88328d new_whale w_daf1085 w_ee9c4d7 w_a3dbc8f
c8bf8015.jpg,w_a846944 w_23526cb w_6d17527 w_ba56291 w_6a87d0d
bbe1f7e0.jpg,w_18eee6e w_53064a6 w_9875c12 w_bb2d34d new_whale
4b5e982b.jpg,w_53064a6 w_e54feba w_9875c12 w_434ad6a w_655bba3
03ef82dd.jpg,w_d0b237f new_whale w_551f5ca w_616ca36 w_6de53d1
e20eecfb.jpg,new_whale w_cf0c062 w_1eafe46 w_b066aa6 w_06a6351
aabb8a25.jpg,w_24ad46c w_d521332 w_1a229eb w_ed8a846 w_d22af00
f9feb540.jpg,w_83714b7 w_b9e00eb w_9948a99 w_77aca60 w_5cb5fc3
5a5fc942.jpg,w_78999a6 w_48a98d7 w_9ea2cc3 w_11adaae w_8d46cef
c87686e2.jpg,w_79d4855 w_1596a47 w_a074c7e w_7b035cc w_9b67e87
be9db345.jpg,w_2dae424 w_f256b56 w_5f84b1a w_c26f6db w_419d308
52f9198d.jpg,w_b6d4901 w_813c5be new_whale w_41ed8e8 w_32a920b
9dc996ac.jpg,w_88b5d47 w_d33c2ed w_f95ef7c w_847b884 w_b71eab2
582e471f.jpg,w_17e8554 new_whale w_eea20c4 w_b48535f w_099c712
c921260f.jpg,w_9448c34 w_f801078 w_f51b4bc new_whale w_6bbaa92
2a6e3b3d.jpg,w_5557280 w_1274a11 w_0ecff13 w_71e6583 w_f6c23d5
80f8115d.jpg,w_a8bc2bc w_5ffa454 w_79581d3 w_7c2d27c w_d0874bb
4563267e.jpg,w_44cccf6 w_c0d494d w_4114553 w_987a36f w_22b09d0
f0500434.jpg,w_0087fdd w_4f6fabd w_38e4aae w_01b2250 w_41ed8e8
2a2e2a41.jpg,w_bbc2a14 w_31d3999 w_3572b44 w_7de72c5 w_5d84c65
c835eafa.jpg,w_bccfcc1 w_c241e72 w_0acce53 w_25a38b8 new_whale
4b3e93cf.jpg,new_whale w_9b401eb w_ba39446 w_b7d5069 w_0475042
43317cb0.jpg,w_c1b685f w_bb388ca w_0acce53 new_whale w_95aad92
676713d6.jpg,w_94cd45e new_whale w_e2d0aaa w_8fb79a2 w_8c1ec28
1f261407.jpg,w_1596a47 w_8db45b7 w_599d0df w_479e3e5 w_8f1946f
0852f2b0.jpg,w_8c1e2e4 w_ddf14ae new_whale w_861cc1c w_d428980
10b0ed93.jpg,w_eb0a6ed new_whale w_886257d w_60c5e7e w_654a5bb
358138e2.jpg,w_8242022 w_cfe35d4 w_32602d9 w_8f776ed w_556df30
7cd1936f.jpg,w_7c7a78c w_7e841fa w_63db6f9 new_whale w_a59905f
f93c44d4.jpg,w_553bb6e w_ae0ab55 w_cd70e8b w_599d0df w_1596a47
4d5b8d47.jpg,w_a526492 w_b8cba61 w_6556c5c w_009dc00 w_86b9dfd
2b401dea.jpg,w_964ce09 w_42c631a w_ba9bc6d w_8c3db0a w_845f7ca
fc9974a0.jpg,w_c0d494d w_0e9f6d9 w_e80641a w_dc89c4c w_49bbc79
f5443204.jpg,new_whale w_5557280 w_c26666e w_125ba17 w_0b3c02c
a3ec9135.jpg,w_5ae47d9 w_49c640f w_5817e08 w_2a18a44 w_40323ac
4120bc17.jpg,w_73d5489 w_ba56291 w_699be3a w_7028d77 w_5010531
675337eb.jpg,w_ceffa10 w_5415fcb w_64783fe w_1febbf3 w_a254eb0
3dfefebc.jpg,w_73d5489 w_6460698 w_8dcd784 w_c90c37a w_c2c4f43
9c7d6b3d.jpg,w_48a98d7 w_5557280 w_1cca86d w_28fa29e w_c027e4e
5e54060d.jpg,w_26dd948 w_f334363 new_whale w_6d4dedc w_f0b4252
5c2b8d3b.jpg,w_3b5403b w_4f37147 w_1a70685 w_1ae1386 w_b41e229
deb23bc1.jpg,w_d5ec83f w_bbf20b4 w_2168ae2 w_aa16da4 w_118d911
82422673.jpg,w_2ac83b0 w_9c61d57 w_23526cb w_3f5e7fc w_6a87d0d
d9719878.jpg,w_49bbc79 w_64f3545 w_1287fbc w_32a920b w_c0d494d
97ba1748.jpg,w_a3dbc8f new_whale w_9d704ab w_2d99a0c w_cf00b01
983dd7a4.jpg,w_98baff9 w_0aae8c1 w_6c99c53 w_f0fc693 w_5a1b758
db54d54b.jpg,w_d88328d w_398aa7f w_65c80dd new_whale w_c6be61e
80d029bf.jpg,w_af8cad1 w_56f2b1e w_a0149f9 w_1ec0481 w_452400e
97f77ebe.jpg,w_bbc2a14 w_04c1951 w_50a6e73 w_9434f0c w_c103b25
c9508dbd.jpg,w_ae1db8a w_f21f2ec w_2fe43c7 w_c8d20aa w_1add6ae
d5cae284.jpg,w_c57623d w_f81c626 w_17e8554 w_2f81b85 w_ef2f0f0
b7630ddd.jpg,w_97e63b3 w_a965f14 w_735ce7d w_57c14db new_whale
f63572f4.jpg,w_987a36f w_28ce17c new_whale w_1ae1386 w_e156c87
a21e2c40.jpg,w_451f507 w_e3c119c w_59eb8ae w_9ceb05d w_97f5054
3a2b6223.jpg,w_eb8429c w_4696a5a w_d775542 w_1596a47 w_ae0ab55
09d7ac3c.jpg,w_31d3999 w_3f2a05c w_22b8a16 w_c9dd32e w_10bea88
db7c5cf2.jpg,w_89e159a w_78f2e92 new_whale w_2a939eb w_dbaa2b1
67d30ebe.jpg,w_98baff9 w_e3c119c w_861cc1c w_6c803bf w_d234e6b
a24a25e8.jpg,w_25db560 w_e826a6f w_0a97a25 w_ded09c7 w_8ba2066
62d88065.jpg,w_2196938 w_97bc172 w_b454f70 w_37223f9 w_a1237e3
243ef9d5.jpg,w_a965f14 new_whale w_72e70e5 w_a93c8f9 w_db0ad01
804fdd64.jpg,new_whale w_fea7fe6 w_735ce7d w_2071a4c w_97e63b3
4ed9f0c9.jpg,w_68b47a1 w_b454f70 w_f44277f w_b678944 w_f0b4252
fd1bc41b.jpg,w_985877e w_adc6e1b w_0ac6a0a w_1ae1386 w_b4732ef
751f8e03.jpg,w_133ecf4 w_5cef366 w_d234e6b w_7028d77 w_23cd105
0126c54c.jpg,w_7049d9f w_735d8a4 w_5c6215c w_53064a6 w_7185713
db3e0637.jpg,w_fe49bc4 w_d663f4f w_c30959a w_cf0c062 w_a21cc97
07175ead.jpg,w_9a4bd76 w_31a93e7 w_a837660 w_d663f4f w_d224115
bc0ebd0a.jpg,new_whale w_efd3f81 w_99ad599 w_719011d w_881f3c4
0658195c.jpg,w_1febbf3 w_8f776ed w_8242022 w_e94d02c w_7caa4fe
2dbd3192.jpg,w_1d53d9c w_ab4cae2 w_b074cdf w_98baff9 w_cae7677
9fb5fcb1.jpg,w_3d0bc7a w_3349c9d w_b648329 new_whale w_f208155
97d03954.jpg,w_da2efe0 w_9868b95 w_f185562 w_eec1133 w_4659acf
f4721f88.jpg,w_068f5bd w_29670e2 w_38158d6 w_0b7cc25 w_24a2923
14ab5e1e.jpg,w_4fd48e7 w_91572bb w_bd1c23d w_ee17a08 w_33909b8
dca86460.jpg,w_4b83ce2 w_9875c12 w_f229b69 w_f18df18 w_0a91f24
a1d99705.jpg,w_8c1e2e4 w_87050a3 w_813c5be w_6e8486d w_3d66298
1d99196e.jpg,w_5ba417d w_a25caa9 w_7885601 w_19aeb9c w_dd76ce2
ec942998.jpg,w_5b99089 w_ebe0ad5 w_44f66a7 w_f714476 w_febafc1
72bb2194.jpg,w_f8cd6b6 w_26dd948 w_e57b487 w_f7a0fd7 w_4a074b8
cff871dc.jpg,new_whale w_c34afd7 w_18eee6e w_daeb296 w_1a70685
2248e860.jpg,w_94cd45e w_aa7e5f4 w_d36f58c w_1a4ae2c w_44cccf6
1b29ff0d.jpg,w_76599c3 w_59eb8ae w_f18df18 w_11f6df1 w_d782e1b
e3a14b02.jpg,w_5a81425 new_whale w_5d96ba4 w_ee23a5f w_e4f1fcc
c93668ac.jpg,w_1e45a47 w_3a94311 w_adb041c w_1306632 w_c4c8491
a3a8b8a0.jpg,w_f6fb689 w_8968506 w_30f095d w_e9f85b7 w_3f12226
ae54b8fc.jpg,w_4a0c105 w_fb2c3fb w_38b1edd w_3f0f6ba w_f44277f
d57328f3.jpg,new_whale w_12cdfbd w_dc7c5a0 w_33973bf w_9cb529f
f65c2243.jpg,new_whale w_4fcfa4d w_7142b19 w_a16b600 w_1a2b4f2
f63b9af6.jpg,w_c06dd6e w_314d77b w_35c8057 w_2c1634b w_cece268
d9e5bd66.jpg,w_397e3db w_a4678de w_eff7e35 w_f79b3f9 w_a358522
91df94cd.jpg,new_whale w_57c8da9 w_0819271 w_8327e8d w_91572bb
71ca8656.jpg,new_whale w_8327e8d w_5f82501 w_837646b w_ebff750
00944069.jpg,w_fe49bc4 w_c30959a w_fd07344 w_613723e w_67599af
cd4ff833.jpg,w_0d39a68 w_28ce17c w_1aa0526 w_2bea4c4 w_87c4190
f953b681.jpg,w_f1a4389 w_7f0700f w_5c32d2a w_4cff2f8 w_cd88a48
84f429df.jpg,w_0b04c08 w_b0e05b1 w_4e68ddc w_8fab53d w_08f1502
8e3f3621.jpg,w_af8cad1 w_31d3999 w_9cb2dba w_0d60fdd w_55647bd
6d7bbdce.jpg,w_d9adb4f w_4fb3c95 w_79b42cd w_a7f3698 w_490c8a0
7a715a08.jpg,w_1af5d59 new_whale w_5557280 w_95dd5d2 w_f63d8b0
3b429cf2.jpg,w_c57623d w_9ceb05d w_6710cf8 w_d428980 w_7142b19
98a2735f.jpg,w_b6689cc w_2a939eb w_9db9ef5 w_c0d494d w_6af9dd7
1bbd2deb.jpg,w_fba3bde new_whale w_ab4cae2 w_19a5685 w_86b9dfd
0afda9fe.jpg,w_33b9360 w_18eee6e w_3fffc61 w_987a36f w_11adaae
f57f6497.jpg,w_63d10a1 w_3b99025 w_7a53e0c w_c786765 w_777546c
8a55e8df.jpg,w_fba3bde w_da2efe0 w_330f897 w_98baff9 w_cce912e
b57e757b.jpg,w_2fd21ec w_43b50e5 new_whale w_7e5cc5e w_62c3998
19d2babc.jpg,new_whale w_97e7648 w_ba53619 w_871b1b9 w_f83b1f9
5769b05d.jpg,w_95874a5 w_b6689cc w_1dff010 w_ff2c4a4 w_9ceb05d
ba03013d.jpg,w_80bae3a w_c5f9e78 w_cc22f68 w_89f4a0c w_e101deb
b83bce4b.jpg,w_89e159a w_d6df554 w_7af28d7 w_dbaa2b1 w_b6ed5d2
962de98e.jpg,w_0fecdf7 w_12f2352 w_89e159a w_e6ddfe1 new_whale
abb753ee.jpg,w_367b996 w_f51b4bc w_47d2bc6 w_b6c4efa new_whale
604d6acf.jpg,new_whale w_7419e4b w_d430a71 w_0b3c02c w_c01beb7
93498d86.jpg,w_0b7e949 w_fcee41d new_whale w_d4eb9ed w_b96d4e0
d5591b46.jpg,w_3b99025 w_9434f0c w_31d3999 w_572033c w_b55242e
23838102.jpg,w_d306246 w_8242022 w_f2b8caf w_32602d9 w_e5d6443
383f2cac.jpg,w_f4ac89a w_f802d74 w_9d9913a w_f6fb689 w_bd61ca9
69bbb037.jpg,w_721d2e9 w_0f00e71 w_f22f3e3 w_bb37d93 w_8f3cb68
12e45dcb.jpg,w_6f580eb w_c7b05e7 w_af5d11a w_40cc259 w_8eb63b7
d10e4ab4.jpg,w_a646643 w_5ba417d w_612f4a2 w_bb388ca w_c1b685f
7d279529.jpg,w_62f804d w_ff1b64c w_71bfc77 w_77ee0be w_50729c4
56302932.jpg,w_f8e6546 w_ab4cae2 w_95b6cc3 w_8fab53d w_5f82501
a638f511.jpg,w_530f87b w_0dee306 w_6d4dedc w_47d2bc6 w_79774a5
c639de3a.jpg,w_3b99025 w_24823e2 w_a58f64d w_2730966 w_0f92544
d130cc71.jpg,w_7ed0d17 w_daeb296 w_587d2e3 w_9d3ba38 w_d4b90bf
cec72768.jpg,new_whale w_02facde w_b96d4e0 w_bbf20b4 w_74e15fc
3eeca2e1.jpg,new_whale w_a1237e3 w_9378098 w_0d733a5 w_c2c4f43
1f0a531b.jpg,w_e826a6f w_9a5cd8e w_70daaba w_434ad6a w_ef2f0f0
0fa2ff1e.jpg,w_8c66a16 w_a8335f2 w_f5eb6c6 w_59db39b w_9e22ded
bea8e20d.jpg,w_89d9c03 w_7c8620c w_29d2cec w_bc18612 w_230a0de
bb44facf.jpg,w_5010531 w_d1917df w_9aeb18f w_958b908 w_73321ab
7c3d870f.jpg,w_309a2b3 w_dfec7a3 w_17964ef w_4ec7c66 w_1a70685
6ae51bca.jpg,w_25871da w_74adf0b w_5f54bf3 w_fcfcf68 w_26dd948
8e617483.jpg,w_01b2250 w_33b9360 w_8c1e2e4 w_d428980 w_8534390
46e27bcc.jpg,w_92d55a6 w_b6ed5d2 w_daeb296 w_e39dcea new_whale
234125db.jpg,w_47d2bc6 w_0467840 w_74de378 w_530f87b w_e685c80
846778e6.jpg,w_309a2b3 w_c58b474 w_656afeb w_98baff9 w_c9e1cdc
8c170f31.jpg,new_whale w_ba53619 w_1d38877 w_837646b w_2fdaa7f
73a60dab.jpg,w_3e0f25d w_c39c56e w_49a7077 w_339c8ae w_1ec0481
fee0b0fc.jpg,new_whale w_3fa2cb1 w_559ce61 w_6247b2e w_98baff9
12f9e126.jpg,w_1287fbc w_c0d494d w_0e9f6d9 w_516bedb w_9122179
f4e00037.jpg,w_4ec48a9 new_whale w_61c1f9c w_a38d1a3 w_f1b565a
45ec893c.jpg,w_1743d93 w_b721e96 w_a4f77bd w_d428980 w_8b56cb1
4ed06e71.jpg,new_whale w_a31900f w_46dcce7 w_e62680c w_701972b
88f46a33.jpg,new_whale w_d75aff6 w_f3db3f1 w_c80d300 w_588d5d7
c152e3cd.jpg,w_5824675 w_2bdd2df w_7440549 w_95c7d1b w_67bfdf5
766d2bbf.jpg,w_099c712 w_d0e5d1d w_853c1f7 w_43be268 w_d428980
1b9ed964.jpg,w_9f02482 w_147b62b w_637f363 w_43eea34 w_fd07344
1dd5d5b1.jpg,w_61d516e w_9b67e87 w_89d9c03 w_e59294d w_addcafa
50983bb6.jpg,w_eb47189 w_f86488a w_9db9ef5 w_7419e4b new_whale
db8a291b.jpg,w_2071a4c w_08f1502 w_44a6b62 w_e3c0ae5 w_3e26a99
2594e387.jpg,w_d663f4f new_whale w_48a98d7 w_b678944 w_4e52a49
8fe5dcff.jpg,w_b066aa6 w_7c943ab w_9a2d56b w_c30959a w_fe49bc4
7dad2968.jpg,w_d22af00 w_31a93e7 w_08f1502 w_9aeb18f w_1a229eb
19289acc.jpg,new_whale w_685466f w_38e4aae w_3e1ba5b w_212b985
f7cdee8a.jpg,w_15d1235 w_8fd5636 w_156c0db w_64433af w_d67071c
f4861e0e.jpg,w_7885601 w_b5ea8a0 w_71e851f w_f1396bd w_1f10750
6301b272.jpg,w_21e178f w_c48ad3e w_6710cf8 w_4fcfa4d new_whale
d8dbc21a.jpg,w_3136deb w_ce7c6c0 new_whale w_e4b5d0b w_7e1521a
e8c58ff0.jpg,w_0da589d w_f4fc8cc w_ef7cdd5 w_b38374a w_dbb786d
10152392.jpg,w_5ba417d w_8a31e6c w_1f10750 new_whale w_20f86e1
67172e12.jpg,w_8b56cb1 w_f02bf23 w_1596a47 w_3061bdd w_2db01d5
018541f1.jpg,w_11adaae w_a22f338 w_7ba4b5a w_ab6db0f new_whale
937e3d3e.jpg,new_whale w_d02787f w_c8728f4 w_a1e017f w_302af0a
8d6a5de9.jpg,new_whale w_02facde w_d345e80 w_2e42cc0 w_51cdd4b
6f31bd77.jpg,w_1dc66b7 w_5a29f9d w_2ce5ce2 w_eec1133 w_28fa29e
b168779e.jpg,w_28cd742 w_dfafffd w_0ac9006 w_f79b3f9 w_a4678de
617650c1.jpg,new_whale w_a3cd405 w_8d46cef w_21e178f w_06972d2
6b14d2c4.jpg,w_6e8486d w_9122179 w_01b2250 w_dce3192 w_4e52a49
8cc15aa4.jpg,new_whale w_bd6e2dd w_540fd73 w_014250a w_ae07541
3a7e31d2.jpg,w_bf69a19 w_ab6db0f w_a22f338 w_9ec358c w_7b5a630
7a0d3770.jpg,w_d2be6cc w_59eb8ae w_8ba2066 w_11f6df1 w_3023ee5
572f3a83.jpg,w_8cd3036 w_db2baec w_587d2e3 w_0265cb6 w_cd02407
14385bcb.jpg,w_43b50e5 w_94cd45e new_whale w_e603cc5 w_3e73d8a
b68e867f.jpg,w_fbcb6e4 w_fe49bc4 w_a3dbc8f w_39c7462 w_fdf60bb
90b59d1b.jpg,w_8c1e2e4 w_98f0e93 w_1dff010 w_2071a4c w_b2e1722
40bbd78a.jpg,w_9688819 w_77166cc w_8eceeb8 w_64f3545 w_212b985
b9b87f28.jpg,w_6e1b161 w_5966fff w_45aac7a w_5102893 w_c3ce041
1418b699.jpg,w_681dba6 w_2f54c3c w_c068ed3 w_f792125 w_d708c5a
44a38da7.jpg,w_18eee6e w_17136dc w_ef7755e w_7b035cc w_f51b4bc
8e00270e.jpg,w_569c2c7 w_67de30b w_7c7a78c w_bc9dc37 w_67c1b6f
de2d08c0.jpg,w_1287fbc w_516bedb w_3026ce2 w_7759db0 w_a57351c
ec81eb7a.jpg,new_whale w_773509f w_0408054 w_c6be61e w_d36f58c
66c7c602.jpg,new_whale w_be9bf14 w_f2b8caf w_f4e84c1 w_9438980
52649661.jpg,w_88d11b1 new_whale w_6affb63 w_4e52a49 w_136337c
2da96475.jpg,w_bf8c3d2 w_987a36f w_d9adb4f w_e61dd6d w_895c722
ba5455c0.jpg,w_a3a65b3 w_8f50a1f w_0d2dc7e w_3f754d6 w_e4e6f5b
2076f01b.jpg,w_c9dc73e w_1deadd7 w_71bfc77 w_a71aa99 w_3a9ee71
1794ede4.jpg,w_a22afc6 w_2be1c9c w_b4a5677 w_f478955 new_whale
26b93a33.jpg,w_2071a4c w_735ce7d w_1489751 w_2a04ceb w_da63cba
d7c48b9d.jpg,w_08f1502 new_whale w_9948a99 w_676ddb0 w_05567a9
