Image,Id
ae7383a9.jpg,w_7554f44 w_788b689 w_97da401 w_e9f85b7 w_b074cdf
a6831472.jpg,w_fb2c3fb w_d67071c w_e988011 w_25871da w_449503f
ee10c9ec.jpg,w_3d187b5 w_38b1edd w_a8990f1 w_d26cc27 w_dc97dc3
bea78aee.jpg,new_whale w_f208155 w_69f4311 w_e62b5d8 w_7ed0d17
a4258dd1.jpg,w_5810973 w_80b1c48 w_733f161 w_71bfc77 w_41f0a7e
95c39ab2.jpg,w_413057d w_655bba3 w_ff1b64c w_6c803bf w_71c7322
53b4f6b5.jpg,new_whale w_17ee910 w_3023ee5 w_f8c3a63 w_2222ef0
ef887316.jpg,w_ee17a08 w_b7d5069 w_71764b4 w_1dff010 w_3af4e73
29d1af16.jpg,w_3b5403b w_8b22583 w_67de30b w_a59905f w_1310342
a71ebb26.jpg,w_a048f26 w_f03ca16 w_79f5620 w_c068ed3 w_55c9a3b
70e4726a.jpg,w_87050a3 w_d382236 w_cce912e w_faa4239 w_29d2cec
282ff7c5.jpg,w_0b3c02c w_28fa29e w_9688819 w_f5915b0 w_c027e4e
209c67c5.jpg,w_5cc2285 w_72d5b6c w_fa32440 w_65428d9 w_6c803bf
10f289c4.jpg,w_ca5f17f w_cae7677 w_cbedcb0 w_5a1b758 w_e1f55ad
983e54a7.jpg,w_95874a5 w_63035d1 w_58c3bf9 w_cc759cd w_cf24f84
42464eb7.jpg,w_8e16693 w_c48ad3e w_cb7b682 w_3b5403b w_e2e56e9
935b1151.jpg,w_48a98d7 w_2fd21ec new_whale w_3c0e79e w_895007f
f6af335e.jpg,w_f0f0dbb w_35063ed w_303518a w_2f54c3c w_73d5489
e4fd330f.jpg,new_whale w_449e238 w_a1b985a w_e62680c w_c663985
a9c7e8cf.jpg,w_9023f3b w_c39fceb new_whale w_97768ee w_7bdfc11
cfd9b723.jpg,w_3297a52 w_0337aa5 w_d3ce445 w_985877e w_e0ba9ae
d9f4cd36.jpg,new_whale w_46dcce7 w_2b8e175 w_2270691 w_c663985
ab7c2378.jpg,w_1f00cb7 w_d9787aa w_a048f26 w_bdbec6c w_fdf60bb
fdc07d02.jpg,new_whale w_8b56cb1 w_9b67e87 w_1596a47 w_c0cfd5b
323ee2b3.jpg,new_whale w_53476b2 w_8de6989 w_1b6d34d w_af04ba6
5ce0e1db.jpg,w_d175300 w_d2b4956 w_9b6b87d w_ebf3f26 w_f663b5e
5ab928d8.jpg,w_ebf3f26 new_whale w_490b224 w_686408a w_fbbf84a
97c664f5.jpg,w_95874a5 w_c5e6997 w_19dc50f w_6aa5e66 w_d663f4f
005d5f4f.jpg,w_8fab53d new_whale w_dbda0d6 w_b7d5069 w_4b7b80b
8b19f1ae.jpg,w_883557a w_d9adb4f new_whale w_98f0e93 w_d8f0f46
b0416857.jpg,w_23b9dcb w_7abaf06 w_3cada3d w_2466659 w_f8d2cd9
86ce0dca.jpg,w_96c6151 w_c551c9d w_44237e0 w_31d3999 w_ddf14ae
2e2e87dd.jpg,w_8db45b7 w_b34793e w_12f2352 w_8f3cb68 w_1287fbc
e4ed3d84.jpg,w_ec67c71 w_f37508c w_750dc93 w_076daec w_bf77b13
981b0881.jpg,w_ca8bfb4 w_5a81425 w_18a1bf2 w_1ec0481 w_4f103de
08235f48.jpg,w_cece268 w_6c99c53 w_528e753 w_19c005a new_whale
6bf75a34.jpg,w_392bee3 w_2c68b75 w_7aaa569 w_3f43888 w_83f0b3f
32c9a8fc.jpg,w_bc62c0e w_e655c65 w_cf0c062 w_57c8da9 w_b47a4a1
9aac59f4.jpg,w_8c1e2e4 new_whale w_9ea2cc3 w_a22f338 w_fba3bde
afcb9bb2.jpg,w_d6a6360 w_3222bdb w_1ec0481 w_eb5b6aa w_e57b3ce
243af012.jpg,w_cd88a48 w_53baa9b w_f02bf23 w_7763134 w_75780a0
73c76f39.jpg,new_whale w_c26666e w_2184d07 w_27736a0 w_e8d0bac
ca1cdf55.jpg,w_b6c4efa w_d3ce445 w_f5b8faf w_18eee6e w_4ebeafb
c06d7410.jpg,w_6398e9d w_44a6b62 w_7e8b270 w_ebe0ad5 w_851a7f4
a8c4a993.jpg,w_9615cf1 w_52eecb4 w_d8e752e w_cb8edf5 w_44edba9
62bc02da.jpg,w_33c3ce1 w_e4f1fcc w_53ef628 w_23dce10 w_b7fe199
0c152758.jpg,w_3ae3603 w_269b090 w_a2f02c0 w_b96d4e0 w_ba5336c
f8d40c10.jpg,new_whale w_b678944 w_9db9ef5 w_8ec2960 w_dcb1f2a
66a84f9f.jpg,w_31d3999 w_bbc2a14 w_5d84c65 w_9caed77 w_572033c
501c6841.jpg,w_c34afd7 new_whale w_656afeb w_208de0e w_5c0e858
abbf7619.jpg,w_f95ef7c w_31d3999 w_b5144b0 w_c87b956 w_b71eab2
909de73b.jpg,w_d9adb4f new_whale w_ee17a08 w_fc7cc24 w_41ed8e8
32f210f8.jpg,new_whale w_87c4190 w_5dbe64d w_050bdac w_945aefe
78fa33a1.jpg,w_bc62c0e w_4e68ddc w_e826a6f w_70daaba w_17136dc
cc32bedb.jpg,w_a3cd405 w_987a36f w_d428980 w_099c712 w_685466f
b2f10c43.jpg,w_e4f1fcc w_b089088 w_c3ff6f2 w_3572b44 w_53ef628
16ef8d09.jpg,new_whale w_8fab53d w_40323ac w_9577f88 w_b7d5069
24d2f0f2.jpg,w_af06773 new_whale w_dee1df3 w_d37b55b w_e0799da
91692fe0.jpg,w_b6410bc new_whale w_7e93962 w_f8e6546 w_153645e
bb2b7703.jpg,w_dcf2001 w_3026ce2 w_c9e1cdc w_80c4153 w_1287fbc
e614b474.jpg,w_243e33e w_d5293a1 w_3d4900b w_7417ab0 w_22bb9b3
f7e59ec4.jpg,w_5b576a0 w_b074cdf w_7f1f728 w_e9f85b7 w_41f0a7e
85641036.jpg,w_6cb31c8 w_c06dd6e w_fd6e8d2 w_70715c1 w_c0648b9
11d64450.jpg,w_7538a4c w_987a36f w_6e742e5 w_1ac4c38 w_fe49bc4
62098c71.jpg,w_0c45f5e w_156c0db w_fd6e8d2 w_193b7e3 w_fd218ba
338bd6a4.jpg,w_ddbf533 w_0acce53 w_7de72c5 w_c11932e w_5297ab3
efd323aa.jpg,w_87e00c8 w_414f402 new_whale w_945aefe w_4e52a49
235b0963.jpg,w_a59905f w_f1b565a w_c915956 w_bb2d34d w_398aa7f
3b39d574.jpg,w_b47a4a1 w_ca5f17f w_19aeb9c w_38954da w_39f2064
40aec8f9.jpg,w_d775542 w_056be75 w_3d8c865 w_19212f0 w_651cbb7
0dd686ae.jpg,w_46a4137 w_d3ce445 w_02c9470 w_88d11b1 w_2b969fe
8f0c996b.jpg,w_1596a47 w_af5d11a new_whale w_1d05772 w_93bf889
9bf66e17.jpg,w_797e546 w_5b1fa1d w_22fa4ad w_f104523 w_f763429
6936caf4.jpg,w_d224115 w_8a31e6c w_5ba417d w_64830fa w_e3fbc27
572763fd.jpg,w_a1237e3 w_80c5f01 w_ca5f17f w_5fda054 w_83f0b3f
57be9a29.jpg,w_a59905f w_ee17a08 w_1a2b4f2 new_whale w_95b6cc3
ffdd4807.jpg,w_797e546 new_whale w_f763429 w_22fa4ad w_5b1fa1d
7882f7a2.jpg,new_whale w_e3f51ec w_0bbb3de w_ebff750 w_966e86e
2a48561b.jpg,new_whale w_dfd7ee8 w_e1431ba w_389c788 w_3d66298
04aef21e.jpg,w_4d528e4 w_d382236 w_f6d32e2 w_c02ac49 w_fd1cb9d
f0d3b191.jpg,w_af890ad new_whale w_4b16688 w_79581d3 w_e7b1cb3
de8018da.jpg,w_d6df554 w_8a31e6c new_whale w_64830fa w_62c6a8c
107d3a50.jpg,w_adeee48 w_681dba6 w_adffd9c w_b5d8846 w_c45bfc3
b5d68a5d.jpg,w_f6fb689 w_3f12226 w_ba53619 w_3a78626 w_3f91e04
811fc90f.jpg,w_c128384 w_94e071d w_ade77e6 w_ef6e6a9 w_3b8b9c7
b6188d6c.jpg,w_e53334f w_7600863 w_aed8c22 w_1c6d5f0 w_3cada3d
bafc5b85.jpg,w_7895123 new_whale w_2a939eb w_c0d494d w_9df0865
0c556bc9.jpg,w_b6689cc w_e9cacbf w_8d9c6fc new_whale w_4dfe7cb
3d3a7267.jpg,w_c1b685f new_whale w_c2c4f43 w_35063ed w_7028d77
ab827770.jpg,new_whale w_009dc00 w_0e32aa2 w_4772747 w_bbc4e7c
a09ee0ec.jpg,new_whale w_d89b29e w_bbf20b4 w_bc18612 w_71c7322
7d0ad94b.jpg,w_8ba2066 w_0a97a25 w_bbf20b4 w_3023ee5 w_8f593d4
7489313b.jpg,w_71c7322 w_fd1cb9d w_f2e9055 w_bbf20b4 w_adc6e1b
19da698a.jpg,w_b6ed5d2 w_1a70685 w_64f3545 w_0ac6a0a w_96c141f
12f4c94e.jpg,w_3a47dba w_ab4cae2 w_42f935c w_e9f85b7 w_ebe0ad5
bec10730.jpg,w_3197568 w_3cbccb7 w_6863829 w_1d0e29a w_7edcfa5
db937758.jpg,w_94cd45e w_9b401eb w_43b50e5 w_b5e3076 w_516bedb
57b6c0e5.jpg,w_0f16be3 w_45461e6 w_33e0287 w_a0ae961 w_f207f7d
8d2c4820.jpg,w_6e5b022 w_656ef35 w_750dc93 w_19ca2c6 w_f3b63ba
43da71d4.jpg,w_eb0a6ed w_977d881 w_afe953f w_57c8da9 w_f8e6546
f5ef4c14.jpg,w_7c7a78c w_63db6f9 w_c30959a w_06a6351 w_773509f
8a22da27.jpg,w_fcee41d w_0b7e949 w_1014df7 w_95dd5d2 w_585e948
a7123b49.jpg,w_b5144b0 w_ccbc782 w_2cadad2 w_b952580 w_715c557
85e9fa06.jpg,w_721d2e9 w_6a2c07f w_57c14db w_ed5a7c6 w_8069cbb
4b369237.jpg,w_ba8c7bc w_2be1c9c new_whale w_3664a22 w_71e6583
1ff11dd2.jpg,w_7d9642c w_1a5beb9 w_50cd600 w_034a3fd w_46b211d
3f2c200a.jpg,w_18df014 w_9caed77 w_0b3b659 w_050d056 w_a1237e3
5a529338.jpg,new_whale w_96c141f w_85f9040 w_fa32440 w_b6689cc
a8b692b6.jpg,new_whale w_cf24f84 w_8d83172 w_f86488a w_18eee6e
88cb3b67.jpg,new_whale w_77e1ae3 w_6d4dedc w_398aa7f w_53ed912
dc9ac5fe.jpg,w_e5250e9 w_3172910 w_9f638d8 w_e3f51ec w_33f5747
b5eddb52.jpg,w_dbda0d6 new_whale w_b7d5069 w_7c7a78c w_434ad6a
053bfc7e.jpg,w_34fd328 w_9d704ab w_0c70bc3 new_whale w_86b3f04
eaa669ea.jpg,w_fe49bc4 w_d663f4f w_ba8c7bc w_eea20c4 w_e02fe7b
7a8de645.jpg,w_4875b75 w_82c9c67 w_288e40b w_2111212 w_950b5cf
709a3c87.jpg,new_whale w_715d152 w_29fc831 w_abe383e w_a3dbc8f
404fb5b9.jpg,w_b942708 w_076c122 w_600faae w_e2920e1 new_whale
b8845cef.jpg,w_7257028 w_a1237e3 w_fe6617a w_5d8c038 w_83f0b3f
cf08963b.jpg,new_whale w_d5ec83f w_d1eab36 w_778ee6e w_ff7630a
f858d42b.jpg,w_77e3e0f w_7e1521a w_e4f1fcc w_c068ed3 w_23dce10
63b79b44.jpg,w_034a3fd w_3745f59 w_b952580 w_b5144b0 w_d33c2ed
5b91bb76.jpg,w_cc8241b w_5f9fd41 w_599d0df w_9b67e87 w_1596a47
7fdea404.jpg,w_bbd9409 w_53549df w_3a9ee71 w_af5d11a w_1d05772
8648516b.jpg,w_02facde w_c58b474 w_656afeb w_6c803bf w_a4f77bd
f48b040b.jpg,new_whale w_511c464 w_1310342 w_656afeb w_3e1ba5b
1d816fdc.jpg,w_86b9dfd w_77ee0be w_54fc5b3 w_5f50b5e w_50729c4
10edd168.jpg,w_6918155 w_12c3d3d w_5d0666e w_63d10a1 w_33032d1
fad8f976.jpg,new_whale w_1a29ba5 w_1af5d59 w_c26666e w_f63d8b0
a7762731.jpg,new_whale w_dcb1f2a w_44cccf6 w_49ae15d w_02d5fad
d2c419e9.jpg,new_whale w_6c803bf w_026fdf8 w_6ef68ed w_8201aa8
6b00224c.jpg,w_d651356 w_60c5ba0 w_711d58c w_80c692d w_9d48bcf
02ed6104.jpg,w_c4e71b6 w_5e78545 w_bccfcc1 new_whale w_33f5747
dbd61d07.jpg,w_3f12226 w_30f095d w_e7e1bd1 w_fe95ab8 new_whale
165c15d1.jpg,new_whale w_63d10a1 w_9434f0c w_7294a6a w_4f103de
090cb262.jpg,w_1c69443 w_cbfbeb4 w_dbc4dcc w_8db45b7 w_0988bbb
06fc99b2.jpg,w_44cccf6 new_whale w_58c3bf9 w_b05c57f w_b729b1f
1dc44947.jpg,w_b8cba61 w_5c62a56 w_578a509 w_d4bc10d w_b4151b7
81bf48d9.jpg,w_78ba632 w_67c1b6f w_d47e2e3 w_86b9dfd w_a846944
e09b8ac3.jpg,w_3e1ba5b w_4e52a49 new_whale w_01b2250 w_2bea4c4
31595f38.jpg,w_3d0bc7a w_b942708 w_0771d4b w_e2920e1 w_8719b04
6b49cf93.jpg,w_cb6a206 w_acbc912 w_80c692d w_7edcfa5 new_whale
c7e614bd.jpg,w_1632307 w_93dcf76 w_06f0fd3 w_ec95acb w_85cdd9b
b0473b2b.jpg,w_c30959a w_e73d83c w_3026ce2 w_3d66298 w_fe49bc4
4555fa25.jpg,new_whale w_d3f5be3 w_1a70685 w_f86488a w_3f8f5aa
7f7afb9c.jpg,w_43be268 w_7538a4c w_0740d28 w_7142b19 w_1c32062
a15046fb.jpg,new_whale w_da2efe0 w_8601045 w_69e998f w_078b0e7
4ca0b3a1.jpg,w_1d0e29a w_fdf60bb w_39d2684 w_f03ca16 w_00fbb4e
a93f54af.jpg,w_6c803bf w_1539fee w_87e00c8 w_900f9eb w_0087fdd
6c843a63.jpg,w_61b87f9 w_7c943ab w_17e8554 w_7bcc2d6 w_06f85b2
a3f4bc74.jpg,w_b2d937a new_whale w_a524549 w_c01e25d w_a232f9e
92f8f129.jpg,w_721d2e9 w_0f00e71 w_f22f3e3 w_bb37d93 w_8f3cb68
4aa5f954.jpg,w_8b56cb1 new_whale w_a59905f w_53064a6 w_c133ea8
5eee6f7d.jpg,w_7417b12 w_b4a5677 w_7c91fa7 w_ba8c7bc w_7e841fa
bac2424e.jpg,w_a59905f w_398aa7f w_a22afc6 w_2f283f3 w_4855bd3
715df670.jpg,w_57c8da9 w_c00534d w_7e93962 w_1489751 w_ebe0ad5
793b9ee9.jpg,w_2c6fe6f w_f790728 w_6cb31c8 w_883557a w_1ac4c38
297890e6.jpg,w_adc6e1b w_987a36f w_f2e9055 w_b820615 w_8c1e2e4
3074f59f.jpg,new_whale w_8a438a4 w_813c5be w_8cd6d46 w_d02787f
6a029ceb.jpg,w_3aa2073 w_881f3c4 new_whale w_99ad599 w_f0f0dbb
8e0f3faa.jpg,new_whale w_8b1ca89 w_ee24bac w_1d4f970 w_7285eb3
ed462916.jpg,new_whale w_b7d5069 w_e964ae8 w_de51d16 w_deb33de
dbe7e18c.jpg,w_50cd600 w_5bdcd94 w_ef67a6c w_1969a9d w_19ca2c6
bbe74706.jpg,w_7b1686d w_676ddb0 w_09c1e0b w_ba17206 w_1632307
14a562f2.jpg,w_83accca w_1beadba w_5059889 w_705e0fb w_6e20206
04f46b7d.jpg,new_whale w_511c464 w_15928c6 w_e02fe7b w_abe383e
9cd593ac.jpg,w_44f66a7 w_bdbec6c w_94cd45e w_a91600a w_6635a97
57dd15c8.jpg,w_0771d4b w_a687e28 w_c352046 new_whale w_ed69e9c
d4879242.jpg,w_62c548b w_19dc50f w_d663f4f w_703e39b w_f3bd33a
c621f62a.jpg,w_ab9fa59 w_403f92f new_whale w_a1b985a w_fbb485b
261e304f.jpg,w_34c4927 w_3b3b9b2 w_4790f64 w_fc7cc24 new_whale
00e24ca4.jpg,w_adc6e1b w_a0ae961 w_cbda4ca w_985877e w_7ab1759
999dbb51.jpg,new_whale w_01c2cb0 w_ec27074 w_fd1a27f w_e5d6443
3cb775eb.jpg,w_9f3e4f4 w_0ae998f w_ca55545 w_f8cf8ca w_6611a71
6c106890.jpg,w_048f7a9 w_35c8057 w_b80a9c5 w_90ec71a w_9023f3b
290fa7dd.jpg,w_0e9f6d9 w_1a70685 w_4c9d3df w_2a939eb w_38e4aae
4509275f.jpg,new_whale w_13c6b6b w_dcb1f2a w_4e52a49 w_813c5be
72f8950b.jpg,w_367b996 w_b9e00eb w_54a5871 new_whale w_7311fe4
ca7394f9.jpg,new_whale w_d4c25b6 w_48a98d7 w_505a141 w_715d152
c39e8984.jpg,w_95c7d1b w_4b8d0c9 w_85755f7 w_c128384 w_2f07b15
59afc0ed.jpg,w_c3ff6f2 w_5436d75 w_41c0098 w_7e93962 w_3f91e04
1546f890.jpg,new_whale w_3d2724b w_b1a4f29 w_ce29d2a w_0fea5a3
10aad456.jpg,w_6163581 w_883b284 w_6121036 w_8c957e0 w_3ac13d2
f9f756f6.jpg,w_0acce53 w_90201e3 w_da9f45c w_cc5fae7 w_681dba6
3f8c46b3.jpg,w_ef7cdd5 w_6ddff9b w_5297ab3 w_7cca153 w_ab4bd59
53cdca34.jpg,w_db474c7 w_5c62a56 w_303518a w_626ef9f w_67e6b75
94037273.jpg,w_c6c73b2 new_whale w_718ce15 w_3a78626 w_6b3402d
99385acd.jpg,w_7554f44 w_7c943ab new_whale w_d1eab36 w_397cb24
67af1e7a.jpg,new_whale w_b729b1f w_cf00b01 w_6dc7db6 w_34c4927
0c925c96.jpg,new_whale w_cb3bd52 w_5c62a56 w_0fea5a3 w_3d2724b
0be08bdf.jpg,w_c5f9e78 w_6e1b161 w_10bea88 w_b604c18 w_a9f41fd
3156398d.jpg,w_9c70a11 new_whale w_e7a238b w_e3c1ec4 w_ab9fa59
c0b602d8.jpg,new_whale w_cce0444 w_5c07f42 w_9a5cd8e w_dbda0d6
b924951e.jpg,w_35c8057 w_1274a11 w_72e70e5 w_90f5d3b w_b678944
53594e9d.jpg,w_3326396 w_861cc1c w_98baff9 new_whale w_ddf14ae
d3520181.jpg,w_3278f8c w_987a36f w_8325a79 w_da64f8d w_94b4478
574994c5.jpg,w_48a5b86 w_fe054f3 w_44a6b62 w_d09e61a w_ebff750
f82cd2a7.jpg,w_2ceab05 w_8c51d17 w_449503f w_330286e w_4620de1
c073f468.jpg,w_5d06bc3 w_fbb485b w_09d654f new_whale w_ab9fa59
3d829de3.jpg,w_1ac4c38 w_c06dd6e w_515d21d w_6cb31c8 w_83accca
31bcc919.jpg,w_8ba2066 w_ea2385d w_25db560 w_ee24bac w_a06bdc4
b0b41ab5.jpg,w_f9fb9d7 w_423e872 w_c829019 w_1911cbb w_272259b
a861fa2f.jpg,w_50729c4 w_dad56c9 w_62f804d w_ff1b64c w_54fc5b3
94a65ef5.jpg,w_cece268 w_88f693b w_0ea659e w_cf0c062 w_33f5747
d13de039.jpg,new_whale w_57c14db w_60c5e7e w_7852bd1 w_133ecf4
704ea44e.jpg,new_whale w_429e9ad w_62c3998 w_3e73d8a w_a38d1a3
c7143654.jpg,w_8d46cef w_8d83172 w_5af463d w_c34afd7 w_a3cd405
d5991789.jpg,new_whale w_ae1db8a w_17e8554 w_e34abbe w_7c943ab
a6bcb7e1.jpg,w_b5ea8a0 w_ab4f3dd w_1a229eb w_3f91e04 w_f6fb689
2d11b0dd.jpg,w_fb2c3fb w_d67071c w_e988011 w_56b9dcd w_0bbb3de
34c029c0.jpg,w_6fa41e8 w_8103039 w_ccfdb00 new_whale w_8c1ec28
83b5a8b1.jpg,new_whale w_e449d3a w_711d58c w_dd52cfc w_c128384
f4228377.jpg,new_whale w_f19faeb w_dbda0d6 w_3331656 w_7e8b270
939e15b5.jpg,w_8596faf w_243e33e w_7234b3d w_61b87f9 w_4368c9e
23eeecf5.jpg,w_693c9ee w_8968506 w_8643ba3 w_861cc1c w_2c3f440
3fa05329.jpg,w_39d2684 w_fd9264d w_ba63af5 w_93dcf76 w_b604c18
36d17009.jpg,w_2dae424 w_ca5abbb w_f256b56 w_f3e948c w_96b697f
d65b91be.jpg,new_whale w_03c84ef w_c26666e w_27736a0 w_d3857a6
26838655.jpg,w_43be268 w_c30959a w_26edeb8 w_1e3ce01 w_06a6351
f212f5c8.jpg,w_a9f41fd w_c5f9e78 w_490b224 w_91b7c58 w_6e1b161
1dabefba.jpg,w_88b5d47 w_c102ec3 w_d33c2ed w_5d0a13f w_9e4a26f
e252b5e1.jpg,w_1287fbc w_c0d494d w_d9aab0a w_5b45503 w_70a31ce
0e9fccf1.jpg,w_b5d8846 w_ce7c6c0 w_0d8fb3f w_8e92130 w_059ac60
56843820.jpg,new_whale w_6e8486d w_813c5be w_d25a717 w_4790f64
944ceaee.jpg,w_33fc58d w_a59905f w_c133ea8 w_bf8c3d2 w_2f81b85
8deb5ed3.jpg,w_e964ae8 w_ace8c54 w_e61dd6d w_cd1f1ed w_80245ee
82aca676.jpg,new_whale w_544f7e7 w_7ad249d w_b329c00 w_a5431ca
290495b8.jpg,w_b48535f w_4659acf w_4f37147 w_d663f4f w_0869575
43348189.jpg,w_b942708 new_whale w_bd61ca9 w_b31d830 w_8c1dab2
ac36b3e2.jpg,w_7311fe4 w_367b996 w_15eae33 w_02c2248 w_fa96a3d
79a2141c.jpg,new_whale w_1eafe46 w_fc7cc24 w_900fab7 w_91d9cd0
a8c81619.jpg,w_8c51d17 w_8242022 w_2ceab05 w_2cb8996 w_ab4bd59
3fc39141.jpg,w_bbf20b4 w_f207f7d w_da1cc7a w_33e0287 w_a0ae961
cf848ac9.jpg,w_b066aa6 w_d22af00 w_08f1502 w_ff1b64c w_5619521
877cdf5d.jpg,w_3aa2073 w_0e4f53c w_1a229eb w_5810973 w_ba56291
e85567d3.jpg,w_95874a5 w_5c0e858 w_4e1f7bd w_2d25d1f w_2832e90
e1dd31f9.jpg,w_dc97dc3 w_3d187b5 w_5054c6a w_de20ab0 w_7600863
0b932fb0.jpg,w_e3c119c w_9ea2cc3 w_b34793e w_6710cf8 w_18eee6e
c7e8f169.jpg,w_38e4aae w_17ee910 w_a687e28 w_1a70685 w_dff77b6
56da2897.jpg,w_b9e00eb w_a18d0dc new_whale w_6cef37c w_b8cba61
689b3eda.jpg,w_4404247 w_ff2c4a4 w_817f022 w_0f00e71 w_05b2ddd
e3de7137.jpg,w_1a70685 new_whale w_da2efe0 w_f86488a w_2f1e886
ab9e7d4b.jpg,w_a254eb0 w_f7e6199 w_4b7b80b w_7f4cd72 new_whale
7edf9484.jpg,w_aa16da4 w_21e178f w_5dc538d new_whale w_17e8554
595d5004.jpg,new_whale w_2ac83b0 w_11c2836 w_d1933be w_9a4bd76
46508563.jpg,w_c6bd2bb w_e08089e w_b71eab2 w_eb5b6aa w_96d9eaf
6f766d10.jpg,w_4fb3c95 w_b066aa6 w_d36f58c w_efebfe8 w_7e8b270
3e6285a2.jpg,w_1287fbc w_b942708 w_e6ddfe1 w_d9aab0a w_78f2e92
517e17a4.jpg,w_f0f0dbb w_7028d77 w_b7a832a w_eb0a6ed w_60c5e7e
1cd74929.jpg,w_29fc831 new_whale w_7419e4b w_b678944 w_70b9e55
33d8742d.jpg,w_38e4aae w_da2efe0 w_4f6fabd new_whale w_c0560ac
274dba78.jpg,w_9caed77 w_ebf9290 w_bc5beaa w_c068ed3 w_d224115
9e6dd290.jpg,w_efebfe8 w_ebff750 w_6d4dedc w_8fab53d w_0013924
c07645c8.jpg,w_92d55a6 w_daeb296 w_8cd3036 w_cd02407 w_c352046
cd474bfc.jpg,w_081dd6e w_74257e8 w_ef67a6c w_e4f1fcc w_effd0ea
6c4e9771.jpg,w_1a4f16e new_whale w_e282300 w_2bdd2df w_0e0e856
4edeecd6.jpg,w_0e9f6d9 w_33973bf w_fc433f7 w_b6689cc w_fd3ce71
e1e81eb3.jpg,w_daf162a w_3d0bc7a w_6b03eb4 w_883b284 w_29fc831
be0c1ba6.jpg,w_e0efc4f w_1287fbc w_4d98ef7 w_6b3402d w_d0b237f
8360decb.jpg,w_7637760 w_1a29ba5 new_whale w_97768ee w_88f693b
1d3c2335.jpg,w_7185713 w_2fd73d9 w_d2324e2 w_59eb8ae w_7a9f3f6
87b6dfd5.jpg,new_whale w_2be1c9c w_7ba4b5a w_dbda0d6 w_35063ed
1f9ed0c5.jpg,w_61b87f9 new_whale w_53064a6 w_54b0844 w_68fb716
c65099d8.jpg,w_f4fc8cc w_7c18f3c w_3b3b9b2 w_3166a4d w_d94c323
b2a9e79f.jpg,w_74de378 w_46a4137 w_e685c80 w_a846944 w_02facde
285241b5.jpg,w_b729b1f w_5dd4772 w_dbaa2b1 w_2f1e886 w_3350425
f935ab99.jpg,w_389c788 w_72d5b6c w_7ba4b5a w_1274a11 new_whale
074be802.jpg,w_bb2d34d new_whale w_2b28681 w_abe383e w_7f999ff
dd579529.jpg,w_fe19618 w_4fa1bd5 new_whale w_d9adb4f w_51df6ac
8a5c2a18.jpg,w_d6df554 w_9df0865 w_13c6b6b w_eec1133 w_e1431ba
366d339a.jpg,w_2ac83b0 w_8c1ec28 w_bc62c0e w_9c61d57 w_21e178f
eedfb25a.jpg,w_5297ab3 new_whale w_b1a4f29 w_94da90b w_e94a3b2
174ae4e1.jpg,w_67de30b w_147b62b w_9e1e818 w_9f02482 w_637f363
89efc3c5.jpg,new_whale w_76c2a95 w_1c6d5f0 w_93aee9e w_203e9d5
438c7fbf.jpg,w_d5ec83f w_8ba2066 w_b4a5677 w_e61dd6d w_ec91e99
2bf7fb01.jpg,w_26dd948 w_f44277f w_5af7a9c w_b454f70 w_ac69cf7
36f85af7.jpg,new_whale w_91b5f87 w_1f95205 w_eb0a6ed w_05567a9
f9d8ffe1.jpg,w_67fecca new_whale w_b7d5069 w_0ce3ccc w_91361f0
79943bb6.jpg,w_1a70685 w_1facad2 w_64f3545 w_ff2c4a4 w_b38374a
8d09b9a6.jpg,w_cf0c062 w_8069cbb w_dace6e9 w_dab75ca w_cece268
372603d9.jpg,w_2dae424 w_7caa4fe w_e94d02c w_edcb241 w_5a6d315
0bf9025a.jpg,w_813c5be w_32a920b w_17ee910 w_dfbfe10 w_62f804d
b2546a0e.jpg,w_f7e6199 w_2870b33 w_9448c34 w_f438375 w_5dc538d
344fc983.jpg,w_6e1b161 w_3ce788a w_0245a27 w_4bd8388 w_32475a1
ab6133d3.jpg,w_3e1ba5b w_7b035cc new_whale w_8d46cef w_38a3f72
500fc5c7.jpg,w_8abcb09 w_8459e39 w_9a4bd76 w_b71d930 w_1d53d9c
8ec67dd6.jpg,w_1ac4c38 w_8861f65 w_0e81e60 w_4f37147 w_8238d51
419e59e1.jpg,w_eb9ab29 w_dba0cd8 w_8a997b8 w_a1237e3 w_dd8299b
1a2c6aee.jpg,w_b729b1f w_9ca943b w_389c788 w_2957331 w_c34afd7
32320fb5.jpg,w_676ddb0 w_d9adb4f w_aa16da4 w_c5f9e78 w_bdbec6c
c9d30e93.jpg,w_b074cdf w_693c9ee new_whale w_153645e w_44a6b62
0a7c5291.jpg,w_5f8b9b9 w_6e120c4 w_0f41afe w_67e6b75 w_23526cb
fc4ec798.jpg,new_whale w_daf1085 w_02d5fad w_d88328d w_ee9c4d7
8a5d59db.jpg,w_9db9ef5 w_bbf20b4 w_29d2cec w_11f6df1 w_a24f581
d31585b5.jpg,w_82bab38 w_cce912e w_96fd936 w_2fe43c7 w_8c1e2e4
1aca3c32.jpg,w_dbda0d6 w_c30959a w_8861715 w_662a132 w_b7d5069
eab8de5b.jpg,w_74e15fc w_361e290 w_e3c119c w_89e451c w_75780a0
07c2f963.jpg,w_7c91fa7 new_whale w_243e33e w_e8c35dc w_5b672ea
bee0c45e.jpg,w_7b770ec w_da0372d w_04c1951 w_ca1850d w_0bc712b
1fedb1cf.jpg,w_bbf20b4 w_f207f7d w_da1cc7a w_ca813c2 w_a0ae961
2839de66.jpg,w_46e45e6 w_4c049c1 w_c80d300 w_3d12652 w_8f7b653
ea0062be.jpg,w_ffa78a5 w_fe49bc4 w_1ae1386 w_b80d2cb w_4659acf
8d46d211.jpg,new_whale w_7bda16b w_511c464 w_1e3ce01 w_dc7c5a0
b23208a6.jpg,new_whale w_8459e39 w_af76f1e w_9a4bd76 w_0d2dc7e
96f99acc.jpg,w_f478955 w_3e1ccc9 w_993dbe8 w_ef2f0f0 w_d1ffed1
8abc36ad.jpg,w_2216a46 w_1addcc2 w_cc504e7 w_0d733a5 w_9378098
270d9835.jpg,w_5e57e8b w_f1a4389 w_050d056 w_b3e6069 w_f03ca16
15dac55a.jpg,w_3cf3853 w_7185713 w_9ae554b w_060bdf2 w_1029f4e
7c350ca4.jpg,w_fb7a56b w_feab6f3 w_9caed77 w_22b8a16 w_b3e6069
7e74530e.jpg,new_whale w_4f51037 w_9496577 w_9989964 w_5374a4c
7ae9945e.jpg,new_whale w_2fd21ec w_e73d83c w_e964ae8 w_3b5403b
2289895b.jpg,w_b7d5069 w_b4a5677 new_whale w_5b672ea w_6092d5c
69532a23.jpg,w_12c3d3d w_219e33c w_0d60fdd w_63d10a1 w_6918155
7c416765.jpg,w_7554f44 w_8c1ec28 w_a59221a w_e9f85b7 w_97da401
ab0b71c2.jpg,new_whale w_7394d75 w_895007f w_987a36f w_7759db0
b2de6d89.jpg,w_7554f44 w_ff7630a w_87050a3 w_86b9dfd w_b074cdf
19c48ad2.jpg,w_d775542 w_8db45b7 w_3db53dc w_651cbb7 w_2f6ad07
a573ef96.jpg,w_44f66a7 w_116a51f w_5b99089 w_676ddb0 new_whale
ab3682d8.jpg,w_987a36f w_06972d2 w_fa96a3d w_db7e2c5 w_e3c1ec4
d08c5c3f.jpg,w_7c7a78c w_33fc58d w_c30959a w_ba8c7bc w_63db6f9
efb24d6f.jpg,w_efbb71a w_e3c119c w_d7de1ee new_whale w_9694b9d
191ed414.jpg,new_whale w_096bc48 w_c551c9d w_ce9b95e w_29670e2
03f88c16.jpg,w_bc9dc37 w_d0e5d1d w_26edeb8 new_whale w_d1eab36
5a9b9882.jpg,w_22f0a7d w_f8cf8ca w_e98432b w_9378098 w_8ecd3a7
46a85627.jpg,w_90201e3 w_681dba6 w_0acce53 w_83a922d w_c6bd2bb
b602e173.jpg,w_c9dd32e w_bccfcc1 w_1ec0481 w_3e0f25d w_eb5b6aa
5dcd1df7.jpg,w_5d86f98 w_7c7a78c w_a2564cf w_a7d4668 w_cd3e1bd
2b9d2917.jpg,new_whale w_88f693b w_684ca15 w_4620de1 w_7a336b4
030ac4a7.jpg,w_ec354a5 new_whale w_3664a22 w_9875c12 w_73bed18
c9b9570d.jpg,w_1dff010 w_53064a6 w_61b87f9 w_434ad6a w_0f96780
8aa33859.jpg,w_7879ee1 w_569c2c7 w_434ad6a w_f81c626 w_0beef28
df8899ef.jpg,w_91f80eb w_6249155 w_2ac069f w_aafa5b5 w_5e78545
d9820fc9.jpg,w_8f1946f w_8db45b7 w_5b8f282 w_479e3e5 w_425da9a
c5c34698.jpg,w_8e3ebeb w_03a2ed7 w_5bc5fc1 w_f438375 w_ace8c54
cf98e481.jpg,w_7c7a78c new_whale w_3b5403b w_d4eb9ed w_cd1f1ed
ac5adaca.jpg,w_398aa7f new_whale w_d88328d w_72e70e5 w_1eafe46
e21c2a5b.jpg,w_0b3c02c w_d430a71 w_2341d0a w_cf8b725 w_b75f378
44f1d1ba.jpg,w_c0a4c9d w_57c14db w_7028d77 w_c1b685f new_whale
c3a14539.jpg,w_7885601 w_b5ea8a0 w_71e851f w_f1396bd w_1f10750
2151e553.jpg,w_01f211f w_dfafffd w_76c2a95 w_5415fcb w_5297ab3
f09a3afe.jpg,w_0be0d81 w_8ecd3a7 w_5444df0 w_6c8601e w_b890652
3fc7fd6c.jpg,w_1287fbc w_89d9c03 w_b0b275e w_59349ea w_32a920b
73a15e60.jpg,w_4b7b80b w_dc89c4c w_c926fc3 w_f3b63ba w_55d6c4f
55ee19da.jpg,w_73e1d5b w_212ad82 new_whale w_0e30df6 w_773509f
ddbf29e1.jpg,w_f83b1f9 w_e34abbe w_04feee0 w_1489751 w_45aac7a
9144be14.jpg,w_75e6bf3 w_8b22583 w_67de30b new_whale w_8c1e2e4
f4f14576.jpg,w_bbd9409 w_e74980b w_77607b5 w_c7b05e7 w_4696a5a
f45e2fe0.jpg,w_3197568 w_43be268 w_16ea0b2 w_ec02248 w_7a9f3f6
7502192f.jpg,w_9434f0c w_156c0db w_33032d1 w_86b3de4 w_339c8ae
ad2965b3.jpg,w_97f5054 w_3b0894d new_whale w_c0d494d w_44cccf6
aed6fbb5.jpg,new_whale w_3023ee5 w_3cf3853 w_54c00ad w_2fdee7b
b2ed94b9.jpg,w_2f6a962 w_67de30b w_8c408dc w_ee94c57 w_d915632
24430865.jpg,new_whale w_398aa7f w_8fab53d w_03a2ed7 w_42f935c
40665236.jpg,w_df092eb w_6e8486d w_001ebbc w_050bdac new_whale
6abfd2d7.jpg,w_f8e6546 w_1eafe46 w_886257d w_d67071c w_3f91e04
c9f3d445.jpg,w_e8c35dc w_23526cb w_18df014 w_8b1d546 w_90f5d3b
c9bfe212.jpg,w_98baff9 w_861cc1c w_654a5bb new_whale w_6202983
69f5f219.jpg,w_c06dd6e new_whale w_2663598 w_c1c73c0 w_70715c1
ddbd3d3f.jpg,new_whale w_dc89c4c w_c9e1cdc w_b942708 w_bd6e2dd
3c3e393c.jpg,w_f8cf8ca w_9b67e87 w_9f3e4f4 w_cd70e8b w_8db45b7
7314f3ae.jpg,w_e02fe7b new_whale w_c95a0ea w_1310342 w_9072f07
d421da7e.jpg,new_whale w_af76f1e w_3da62f8 w_3f754d6 w_af890ad
1151d099.jpg,w_37223f9 w_60759c2 w_adb041c w_2dbb0fe w_e3f7187
eedfaa79.jpg,w_80bae3a w_3b90f9b w_c068ed3 w_b6c0c65 w_b3e6069
a8f8aa13.jpg,w_7885601 w_964c1b3 w_f792125 w_d708c5a w_1272a31
9dc30144.jpg,w_0aae8c1 w_6c99c53 w_d97d54c w_47c5b29 w_fcd8828
bcd6983b.jpg,w_1d53d9c w_f8cd6b6 w_8ba2066 w_b9e00eb w_45e8ea5
9595b03a.jpg,new_whale w_6d17527 w_403f92f w_f5b8faf w_0a91f24
18a99c92.jpg,w_096bc48 w_1969a9d w_acc67ea w_8489554 w_93aee9e
1a869e11.jpg,w_a5431ca new_whale w_76b6f7c w_ca1850d w_3c0e79e
077839e0.jpg,w_19ca2c6 w_97e63b3 w_f3b63ba w_02a768d w_4759be5
cb088584.jpg,w_70e49bc w_7637760 w_c39fceb w_b440303 w_c87b956
8012a979.jpg,w_5d732da w_705e0fb w_a4f1419 w_56f2b1e w_e4b5d0b
396eec6a.jpg,w_fd587bc w_339c8ae w_09d48d1 w_a3c6ed0 w_e4b5d0b
65a2f76b.jpg,w_05b2ddd w_286ec5f w_a5deba3 w_66c1b54 w_43966a3
22d6a8a6.jpg,w_50e125b w_33b9360 w_dc7c5a0 w_900f9eb w_6c803bf
0843e414.jpg,w_44cccf6 new_whale w_987a36f w_11adaae w_d775c6f
d8f91e7c.jpg,new_whale w_8b1ca89 w_4dceacc w_bbf20b4 w_8ba2066
7bb1c795.jpg,w_817f022 w_a89920b w_d25a717 w_b6ed5d2 w_c34afd7
81008b69.jpg,w_59786da w_392bee3 w_d1933be w_a25d46c w_9aeb18f
f367f795.jpg,w_63db6f9 w_a7d4668 w_c30959a new_whale w_2c0af5e
23903ed6.jpg,w_86ff8a6 w_1dff010 w_b6886e5 w_b066aa6 w_c30959a
23aad843.jpg,new_whale w_40323ac w_4b7b80b w_afe953f w_8a66718
5a02c5ce.jpg,w_a59075f w_f79563e w_1febbf3 w_2870b33 w_d2b4956
b4699f93.jpg,w_715d152 new_whale w_b6689cc w_96c141f w_d4fa6f3
795dd4b3.jpg,w_a254eb0 w_1917275 w_3f12226 w_e7e1bd1 w_b066aa6
59954d5d.jpg,w_83accca w_1ac4c38 w_6e20206 w_2c6fe6f w_2b1e2f5
2707b872.jpg,w_9434f0c w_156c0db w_f93d780 w_64433af w_15d1235
ef63966c.jpg,w_c0cfd5b new_whale w_1948625 w_ab4cae2 w_c8f7bcd
38f2a081.jpg,w_895c722 w_e02fe7b w_76599c3 w_2fe43c7 w_8d83172
afc258a7.jpg,new_whale w_576db5d w_93d42a1 w_2d99a0c w_0740d28
4e6c8ee3.jpg,new_whale w_2ac83b0 w_b4a5677 w_a59905f w_ee17a08
b8f2d2e0.jpg,w_efaada7 w_2fdf63b w_e08089e w_4b950da w_f3e948c
376511c8.jpg,new_whale w_a3868fb w_0e32aa2 w_14964c1 w_37a7f78
a6428a04.jpg,w_9b67e87 w_a1114ee w_f02bf23 new_whale w_50db782
358494f8.jpg,w_3076d8c new_whale w_aa16da4 w_ea4935f w_3ae3603
21d4ab4e.jpg,w_fe5e78b w_2196938 w_93dcf76 w_c6439b8 w_bed6af1
96ac5be8.jpg,w_2725793 w_95c7d1b new_whale w_5010531 w_b9e00eb
01485623.jpg,w_28cd742 w_0ac9006 w_c06dd6e w_06ff732 w_a4678de
5fb1a2ca.jpg,w_c45bfc3 w_073f071 new_whale w_70e49bc w_86cc90f
b8eddb2a.jpg,w_d5293a1 w_df15cc8 w_1dff010 w_b2e1722 w_66c1b54
135c2f72.jpg,w_b066aa6 w_7c943ab w_2c3f440 w_b6886e5 w_1ac4c38
46b77243.jpg,w_cef690d w_0de84f0 w_367b996 w_62ca7c8 w_223cebd
76b7d5f8.jpg,w_d96a0cd w_d428980 w_b96d4e0 new_whale w_44f0fa2
a26fad4d.jpg,w_72d5b6c w_2cdf820 w_389c788 new_whale w_9ac8b97
7545184d.jpg,w_e826a6f w_4e52a49 new_whale w_29d2cec w_89d9c03
132c0db6.jpg,w_1a70685 w_db2baec w_9438980 w_fba3bde w_b5383b5
